DATETIME,HEADLINE,SUMMARY,SOURCE,URL,CATEGORIES,TAGS,asset,text
2025-07-28 16:14:54+00:00,Japan’s Metaplanet tops $2 billion in Bitcoin holdings as debt-fuelled strategy intensifies,"Japanese investment firm Metaplanet has officially crossed the $2 billion mark in Bitcoin holdings, following an aggressive buying streak powered by debt and equity financing. As of July 28, blockchain analytics platform Arkham Intelligence confirmed that the firm holds 17,132 Bitcoins , worth approximately $2.021 billion. Arkham @arkham · Follow METAPLANET’S HOLDINGS HIT $2 BILLION OF BITCOIN TODAYMetaplanet’s BTC holdings hit $2B this morning after $46.7M flowed into their wallets from QCP Capital.Metaplanet is the largest Japanese corporate holder of Bitcoin – and they haven’t stopped buying Bitcoin. 7:44 PM · Jul 28, 2025 271 Reply Copy link Read 28 replies This marks a sharp rise from the 12,345 BTC recorded on June 25, when Metaplanet overtook Tesla in corporate Bitcoin reserves. The rapid accumulation reflects Japan’s rising institutional appetite for digital assets, even as Metaplanet’s stock continues to struggle in equity markets. $92 million purchase adds 780 BTC to reserves Metaplanet’s most recent acquisition was linked to a $46.7 million Bitcoin transfer by QCP Capital, a key investor in the firm. Blockchain data shows this transaction was routed directly into Metaplanet’s wallet, likely forming part of a larger $92 million purchase that added 780 BTC to its balance sheet. The information was corroborated by official filings and Arkham Intelligence’s tracking tools. The sharp increase in holdings within a single month underscores the company’s aggressive accumulation strategy, which closely mirrors that of Strategy (formerly MicroStrategy), the largest corporate Bitcoin holder globally. Bitcoin-backed corporate strategies face equity downturn While Metaplanet’s Bitcoin portfolio is growing rapidly, its share price has moved in the opposite direction. The company’s stock is down 25% over the past 30 days and has dropped over 40% from its yearly high. This disconnect is particularly striking given Bitcoin’s current performance near all-time highs. The downturn in Metaplanet’s stock reflects a broader pattern also seen in Strategy, which has similarly lost 25% from its own peak despite holding substantial BTC assets. Both firms employ similar financial models—raising funds via debt and equity to purchase Bitcoin. This model amplifies both potential gains and losses, effectively turning company shares into a leveraged play on Bitcoin. If Bitcoin’s price were to decline significantly, Metaplanet could face liquidity pressures and may be forced to sell portions of its holdings to meet debt obligations. This introduces considerable risk for shareholders, particularly in bearish market cycles. Rising institutional adoption in Japan The pace at which Metaplanet has scaled its BTC treasury signals growing confidence in cryptocurrency among Japanese corporates. Metaplanet began its Bitcoin accumulation in April 2024 and has since executed a series of escalating purchases. From April to late July, its BTC holdings increased by nearly 40%, bolstered by support from institutional investors like QCP Capital. This trend aligns with a broader shift in Japan’s financial ecosystem, where digital assets are becoming increasingly integrated into corporate reserve strategies. While Metaplanet’s approach carries notable financial risk, it also highlights how firms in Asia are experimenting with Bitcoin as a store of value and inflation hedge, similar to some high-profile companies in the US. As of now, Metaplanet remains the largest corporate Bitcoin holder in Japan, and among the top globally. The next few quarters will reveal whether this aggressive strategy pays off—or whether it leads to significant financial strain amid ongoing stock price declines. The post Japan’s Metaplanet tops $2 billion in Bitcoin holdings as debt-fuelled strategy intensifies appeared first on Invezz",invezz,https://invezz.com/news/2025/07/28/japans-metaplanet-tops-2-billion-in-bitcoin-holdings-as-debt-fuelled-strategy-intensifies/,BTC|ASIA|BUSINESS|TRADING|ARKM,Crypto|Stock Market|Bitcoin|Japan|JPY|USD,BTC,"Japan’s Metaplanet tops $2 billion in Bitcoin holdings as debt-fuelled strategy intensifies. Japanese investment firm Metaplanet has officially crossed the $2 billion mark in Bitcoin holdings, following an aggressive buying streak powered by debt and equity financing. As of July 28, blockchain analytics platform Arkham Intelligence confirmed that the firm holds 17,132 Bitcoins , worth approximately $2.021 billion. Arkham @arkham · Follow METAPLANET’S HOLDINGS HIT $2 BILLION OF BITCOIN TODAYMetaplanet’s BTC holdings hit $2B this morning after $46.7M flowed into their wallets from QCP Capital.Metaplanet is the largest Japanese corporate holder of Bitcoin – and they haven’t stopped buying Bitcoin. 7:44 PM · Jul 28, 2025 271 Reply Copy link Read 28 replies This marks a sharp rise from the 12,345 BTC recorded on June 25, when Metaplanet overtook Tesla in corporate Bitcoin reserves. The rapid accumulation reflects Japan’s rising institutional appetite for digital assets, even as Metaplanet’s stock continues to struggle in equity markets. $92 million purchase adds 780 BTC to reserves Metaplanet’s most recent acquisition was linked to a $46.7 million Bitcoin transfer by QCP Capital, a key investor in the firm. Blockchain data shows this transaction was routed directly into Metaplanet’s wallet, likely forming part of a larger $92 million purchase that added 780 BTC to its balance sheet. The information was corroborated by official filings and Arkham Intelligence’s tracking tools. The sharp increase in holdings within a single month underscores the company’s aggressive accumulation strategy, which closely mirrors that of Strategy (formerly MicroStrategy), the largest corporate Bitcoin holder globally. Bitcoin-backed corporate strategies face equity downturn While Metaplanet’s Bitcoin portfolio is growing rapidly, its share price has moved in the opposite direction. The company’s stock is down 25% over the past 30 days and has dropped over 40% from its yearly high. This disconnect is particularly striking given Bitcoin’s current performance near all-time highs. The downturn in Metaplanet’s stock reflects a broader pattern also seen in Strategy, which has similarly lost 25% from its own peak despite holding substantial BTC assets. Both firms employ similar financial models—raising funds via debt and equity to purchase Bitcoin. This model amplifies both potential gains and losses, effectively turning company shares into a leveraged play on Bitcoin. If Bitcoin’s price were to decline significantly, Metaplanet could face liquidity pressures and may be forced to sell portions of its holdings to meet debt obligations. This introduces considerable risk for shareholders, particularly in bearish market cycles. Rising institutional adoption in Japan The pace at which Metaplanet has scaled its BTC treasury signals growing confidence in cryptocurrency among Japanese corporates. Metaplanet began its Bitcoin accumulation in April 2024 and has since executed a series of escalating purchases. From April to late July, its BTC holdings increased by nearly 40%, bolstered by support from institutional investors like QCP Capital. This trend aligns with a broader shift in Japan’s financial ecosystem, where digital assets are becoming increasingly integrated into corporate reserve strategies. While Metaplanet’s approach carries notable financial risk, it also highlights how firms in Asia are experimenting with Bitcoin as a store of value and inflation hedge, similar to some high-profile companies in the US. As of now, Metaplanet remains the largest corporate Bitcoin holder in Japan, and among the top globally. The next few quarters will reveal whether this aggressive strategy pays off—or whether it leads to significant financial strain amid ongoing stock price declines. The post Japan’s Metaplanet tops $2 billion in Bitcoin holdings as debt-fuelled strategy intensifies appeared first on Invezz"
2025-07-28 16:15:08+00:00,Bitcoin Back at $118K After Trump’s EU Trade Deal,"The trade agreement was announced on Sunday in Scotland, where U.S. President Donald Trump has been touring for the past few days. BTC Regains $118K in the Wake of Trump’s Trade Agreement With EU U.S. President Donald Trump says he closed “the biggest deal ever made” after successfully negotiating a trade agreement with the European",bitcoin.com,https://news.bitcoin.com/bitcoin-back-at-118k-after-trumps-eu-trade-deal/,BTC|MARKET|REGULATION,Markets and Prices|Bitcoin (BTC)|Prices,BTC,"Bitcoin Back at $118K After Trump’s EU Trade Deal. The trade agreement was announced on Sunday in Scotland, where U.S. President Donald Trump has been touring for the past few days. BTC Regains $118K in the Wake of Trump’s Trade Agreement With EU U.S. President Donald Trump says he closed “the biggest deal ever made” after successfully negotiating a trade agreement with the European"
2025-07-28 16:19:10+00:00,Galaxy Executes One of the Largest Notional Bitcoin Transactions Ever,"NEW YORK, July 25, 2025 /PRNewswire/ – Galaxy Digital Inc. (NASDAQ: GLXY) (TSX: GLXY), a global leader in digital assets and data center infrastructure, today announced the successful execution of one of the largest notional bitcoin transactions in the history of crypto on behalf of a client. Galaxy completed the sale of more than 80,000 bitcoin—valued … Continue reading ""Galaxy Executes One of the Largest Notional Bitcoin Transactions Ever""",Cryptocurrency News,https://cryptocurrencynews.com/crypto/galaxy-executes-one-of-the-largest-notional-bitcoin-transactions-ever/,,,BTC,"Galaxy Executes One of the Largest Notional Bitcoin Transactions Ever. NEW YORK, July 25, 2025 /PRNewswire/ – Galaxy Digital Inc. (NASDAQ: GLXY) (TSX: GLXY), a global leader in digital assets and data center infrastructure, today announced the successful execution of one of the largest notional bitcoin transactions in the history of crypto on behalf of a client. Galaxy completed the sale of more than 80,000 bitcoin—valued … Continue reading ""Galaxy Executes One of the Largest Notional Bitcoin Transactions Ever"""
2025-07-28 16:20:04+00:00,Tron Inc. seeks $1B to grow TRX holdings as stock rallies,"The former penny stock is riding a 1,300% rally post-merger, as it looks to deepen its crypto treasury strategy with a billion-dollar funding push.",Cointelegraph,https://cointelegraph.com/news/tron-inc-1b-fundraise-trx-holdings-justin-sun-merger?utm_source=rss_feed&utm_medium=rss&utm_campaign=rss_partner_inbound,,,BTC,"Tron Inc. seeks $1B to grow TRX holdings as stock rallies. The former penny stock is riding a 1,300% rally post-merger, as it looks to deepen its crypto treasury strategy with a billion-dollar funding push."
2025-07-28 16:23:05+00:00,"Bitcoin’s Satoshi Nakamoto Could See $130 Billion Fortune Amid Price Surge, Approaching Top Billionaire Ranks","🚀 Are You Chasing New Coins? Catch the newest crypto opportunities. Be the first to buy, be the first to win! Click here to discover new altcoins! Satoshi Nakamoto’s Bitcoin",coinotag,https://en.coinotag.com/bitcoins-satoshi-nakamoto-could-see-130-billion-fortune-amid-price-surge-approaching-top-billionaire-ranks/,BTC|TRADING|ALTCOIN,Bitcoin|News|BTC,BTC,"Bitcoin’s Satoshi Nakamoto Could See $130 Billion Fortune Amid Price Surge, Approaching Top Billionaire Ranks. 🚀 Are You Chasing New Coins? Catch the newest crypto opportunities. Be the first to buy, be the first to win! Click here to discover new altcoins! Satoshi Nakamoto’s Bitcoin"
2025-07-28 16:23:09+00:00,"Crypto Whales Dump Over 40,000 BTC as Traders Enter “Uncertain” Zone","The cryptocurrency market experienced slight fluctuations after a period of bullishness, resulting in mixed sentiments among traders.",zycrypto,https://zycrypto.com/crypto-whales-dump-over-40000-btc-as-traders-enter-uncertain-zone/,BTC|MARKET,Bitcoin|News|Bitcoin News|BTCUSD|BTCUSDC|BTCUSDT|Cryptocurrency News|XBTUSD,BTC,"Crypto Whales Dump Over 40,000 BTC as Traders Enter “Uncertain” Zone. The cryptocurrency market experienced slight fluctuations after a period of bullishness, resulting in mixed sentiments among traders."
2025-07-28 16:25:11+00:00,Spot Bitcoin ETF: SEC Delays Spark Uncertainty for Grayscale and Truth Social,"BitcoinWorld Spot Bitcoin ETF: SEC Delays Spark Uncertainty for Grayscale and Truth Social The cryptocurrency market often operates on a tightrope of innovation and regulation. In the latest development, the U.S. Securities and Exchange Commission (SEC) has once again captured headlines, extending the review deadlines for two significant exchange-traded fund (ETF) applications. This move impacts not only Grayscale’s proposed spot Solana (SOL) ETF but also the highly anticipated Truth Social Spot Bitcoin ETF . For investors and enthusiasts alike, these extensions spark crucial questions about the future trajectory of crypto integration into traditional finance. What’s Happening with the Spot Bitcoin ETF Delays? The recent announcement from the SEC underscores its cautious approach to digital asset products. Specifically, the regulatory body has pushed back its decision-making timeline for two distinct ETF proposals: Grayscale’s Spot Solana ETF: Grayscale, a prominent digital asset manager, is seeking to convert its Solana Trust into a spot ETF. This would allow investors to gain exposure to SOL without directly owning the cryptocurrency. The extension indicates the SEC requires more time to assess the unique market dynamics and regulatory considerations surrounding Solana. Truth Social Spot Bitcoin ETF: Less conventional but equally noteworthy is the proposed Spot Bitcoin ETF linked to Truth Social, the social media platform associated with Donald Trump. This application, through a partnership, aims to provide investors with a new avenue for Bitcoin exposure. The delay here highlights the SEC’s continued scrutiny over Bitcoin-related products, even after approving several others earlier this year. These extensions are not uncommon in the world of ETF approvals. The SEC’s mandate is to protect investors, and this often involves thorough reviews of market manipulation risks, liquidity, and custody arrangements for novel products like cryptocurrency ETFs. While frustrating for applicants and eager investors, these delays are part of a standard, albeit often protracted, regulatory process. Why Do SEC ETF Deadlines Matter for the Crypto Market? The SEC’s decisions on ETF applications hold significant weight for the broader cryptocurrency market. Here’s why these deadlines are so closely watched: Market Sentiment and Price Action: Anticipation of an ETF approval often fuels positive market sentiment, leading to price surges for the underlying asset. Conversely, delays or rejections can trigger sell-offs. The extensions for both the Solana and Spot Bitcoin ETF applications introduce a period of uncertainty, which can lead to volatility. Institutional Adoption: Spot ETFs are crucial gateways for institutional investors. They offer a regulated, familiar investment vehicle that sidesteps the complexities of direct crypto ownership, such as managing private keys or dealing with unregulated exchanges. Delays in approving such products can slow down the influx of large-scale capital into the crypto space. Regulatory Clarity: Each SEC decision, whether an approval or a delay, contributes to the evolving regulatory landscape for digital assets. It provides insights into the SEC’s concerns and requirements, helping other potential issuers tailor their applications. The consistent scrutiny of crypto ETFs reflects the SEC’s ongoing efforts to establish clear guidelines in a rapidly innovating sector. The history of Bitcoin ETF approvals itself is a testament to the SEC’s meticulous approach. It took years of applications, rejections, and legal battles before the first spot Bitcoin ETFs were finally approved in early 2024. This precedent suggests that while eventual approval might be likely for many legitimate applications, the path is rarely straightforward. Navigating the Future of Crypto ETFs : Challenges and Opportunities The road to widespread crypto ETF adoption is paved with both significant challenges and immense opportunities. Understanding these dynamics is key to appreciating the SEC’s deliberative process. Challenges: Regulatory Ambiguity: Despite progress, the regulatory framework for cryptocurrencies in the U.S. remains fragmented. Different agencies have varying jurisdictions, creating a complex environment for digital asset products. Market Volatility and Manipulation Concerns: The inherent volatility of cryptocurrencies and concerns about potential market manipulation are primary reasons for SEC caution. The agency seeks assurances that ETFs will not expose investors to undue risks. Custody and Security: Ensuring the secure custody of underlying digital assets is a paramount concern. ETFs must demonstrate robust security measures to protect investor funds from hacks or theft. Opportunities: Mainstream Accessibility: ETFs democratize access to cryptocurrencies, allowing everyday investors to participate through traditional brokerage accounts without needing to navigate crypto exchanges. Increased Liquidity and ",bitcoinworld,https://bitcoinworld.co.in/spot-bitcoin-etf-delay/,BTC|REGULATION|MARKET|BUSINESS|SOL,Crypto News|BITCOIN|Crypto ETF|Grayscale|SEC|Solana,BTC,"Spot Bitcoin ETF: SEC Delays Spark Uncertainty for Grayscale and Truth Social. BitcoinWorld Spot Bitcoin ETF: SEC Delays Spark Uncertainty for Grayscale and Truth Social The cryptocurrency market often operates on a tightrope of innovation and regulation. In the latest development, the U.S. Securities and Exchange Commission (SEC) has once again captured headlines, extending the review deadlines for two significant exchange-traded fund (ETF) applications. This move impacts not only Grayscale’s proposed spot Solana (SOL) ETF but also the highly anticipated Truth Social Spot Bitcoin ETF . For investors and enthusiasts alike, these extensions spark crucial questions about the future trajectory of crypto integration into traditional finance. What’s Happening with the Spot Bitcoin ETF Delays? The recent announcement from the SEC underscores its cautious approach to digital asset products. Specifically, the regulatory body has pushed back its decision-making timeline for two distinct ETF proposals: Grayscale’s Spot Solana ETF: Grayscale, a prominent digital asset manager, is seeking to convert its Solana Trust into a spot ETF. This would allow investors to gain exposure to SOL without directly owning the cryptocurrency. The extension indicates the SEC requires more time to assess the unique market dynamics and regulatory considerations surrounding Solana. Truth Social Spot Bitcoin ETF: Less conventional but equally noteworthy is the proposed Spot Bitcoin ETF linked to Truth Social, the social media platform associated with Donald Trump. This application, through a partnership, aims to provide investors with a new avenue for Bitcoin exposure. The delay here highlights the SEC’s continued scrutiny over Bitcoin-related products, even after approving several others earlier this year. These extensions are not uncommon in the world of ETF approvals. The SEC’s mandate is to protect investors, and this often involves thorough reviews of market manipulation risks, liquidity, and custody arrangements for novel products like cryptocurrency ETFs. While frustrating for applicants and eager investors, these delays are part of a standard, albeit often protracted, regulatory process. Why Do SEC ETF Deadlines Matter for the Crypto Market? The SEC’s decisions on ETF applications hold significant weight for the broader cryptocurrency market. Here’s why these deadlines are so closely watched: Market Sentiment and Price Action: Anticipation of an ETF approval often fuels positive market sentiment, leading to price surges for the underlying asset. Conversely, delays or rejections can trigger sell-offs. The extensions for both the Solana and Spot Bitcoin ETF applications introduce a period of uncertainty, which can lead to volatility. Institutional Adoption: Spot ETFs are crucial gateways for institutional investors. They offer a regulated, familiar investment vehicle that sidesteps the complexities of direct crypto ownership, such as managing private keys or dealing with unregulated exchanges. Delays in approving such products can slow down the influx of large-scale capital into the crypto space. Regulatory Clarity: Each SEC decision, whether an approval or a delay, contributes to the evolving regulatory landscape for digital assets. It provides insights into the SEC’s concerns and requirements, helping other potential issuers tailor their applications. The consistent scrutiny of crypto ETFs reflects the SEC’s ongoing efforts to establish clear guidelines in a rapidly innovating sector. The history of Bitcoin ETF approvals itself is a testament to the SEC’s meticulous approach. It took years of applications, rejections, and legal battles before the first spot Bitcoin ETFs were finally approved in early 2024. This precedent suggests that while eventual approval might be likely for many legitimate applications, the path is rarely straightforward. Navigating the Future of Crypto ETFs : Challenges and Opportunities The road to widespread crypto ETF adoption is paved with both significant challenges and immense opportunities. Understanding these dynamics is key to appreciating the SEC’s deliberative process. Challenges: Regulatory Ambiguity: Despite progress, the regulatory framework for cryptocurrencies in the U.S. remains fragmented. Different agencies have varying jurisdictions, creating a complex environment for digital asset products. Market Volatility and Manipulation Concerns: The inherent volatility of cryptocurrencies and concerns about potential market manipulation are primary reasons for SEC caution. The agency seeks assurances that ETFs will not expose investors to undue risks. Custody and Security: Ensuring the secure custody of underlying digital assets is a paramount concern. ETFs must demonstrate robust security measures to protect investor funds from hacks or theft. Opportunities: Mainstream Accessibility: ETFs democratize access to cryptocurrencies, allowing everyday investors to participate through traditional brokerage accounts without needing to navigate crypto exchanges. Increased Liquidity and"
2025-07-28 16:25:37+00:00,Tron Inc. Considers $1 Billion Funding to Potentially Expand TRX Treasury Following Reverse Merger,"🚀 Are You Chasing New Coins? Catch the newest crypto opportunities. Be the first to buy, be the first to win! Click here to discover new altcoins! Tron Inc. is",coinotag,https://en.coinotag.com/tron-inc-considers-1-billion-funding-to-potentially-expand-trx-treasury-following-reverse-merger/,TRX|BTC|REGULATION|BNB|ALTCOIN,Bitcoin|News|BNB|BTC|Core|TRX,BTC,"Tron Inc. Considers $1 Billion Funding to Potentially Expand TRX Treasury Following Reverse Merger. 🚀 Are You Chasing New Coins? Catch the newest crypto opportunities. Be the first to buy, be the first to win! Click here to discover new altcoins! Tron Inc. is"
