DATETIME,HEADLINE,SUMMARY,SOURCE,URL,CATEGORIES,TAGS,asset,text
2025-07-28 14:27:41+00:00,Trump Media Invests $300 Million in Bitcoin-Linked Derivatives,"Trump Media and Technology Group (TMTG), the digital media company tied to U.S. President Donald Trump, has made a substantial $300 million investment in Bitcoin-related derivatives. The move, first reported by Bloomberg , marks an escalation of the company''s already aggressive crypto strategy. It now combines traditional holdings with high-risk options linked to exchange-traded funds (ETFs), blockchain equities, and convertible bonds.This allows TMTG to profit from price movements across the crypto sector without increasing its direct Bitcoin stake. It''s a calculated bet on market volatility that could bring significant upside. However, if prices dip, the company could be left with worthless contracts.$2 Billion in Holdings and a Bet on Market TimingEven before this latest investment, TMTG held around $2 billion in Bitcoin and related assets, accounting for roughly two-thirds of its liquid reserves. Now, with the addition of derivatives, the company is embracing a two-pronged strategy. It aims to hedge against short-term price fluctuations while remaining committed to Bitcoin in the long term.Experts Warn of Policy-Market OverlapThe investment has sparked ethical concerns, especially given Trump’s outsize influence in both political and digital spheres. His social media posts on Truth Social have previously moved crypto markets. Most notably, in March, his call for a U.S. Bitcoin reserve sent Bitcoin and Ethereum prices soaring.With TMTG now financially positioned to benefit from such price movements, analysts are warning that the overlap between Trump’s political clout and his business interests could create serious conflicts of interest. “When someone with market-moving power also holds a financial stake, the incentive structure gets murky,” said Steve Sosnick, chief strategist at Interactive Brokers. “Derivatives only amplify that risk.” Nick Carter, a general partner at Castle Island Ventures, echoed those concerns, noting that Trump’s dual roles as a political leader and a crypto-adjacent business figure could distort market conditions if left unchecked.A Broader Pro-Crypto AgendaThe move is not happening in isolation. Trump and his allies have recently ramped up pro-crypto rhetoric, including backing the GENIUS Act and proposing a federally backed Bitcoin reserve. TMTG’s financial moves align with this broader vision, positioning the company at the intersection of political messaging and cryptocurrency strategy.While a handful of public companies hold Bitcoin, few are deploying derivatives at this scale, making TMTG’s approach both unconventional and risk-laden.White House Pushes Back Amid Industry SkepticismIn response to mounting criticism, White House spokesperson Seth Fields stated that “President Trump has never been involved in conflicts of interest and will never be involved.” However, many in the financial community remain unconvinced, citing the unprecedented mix of public influence and private capital exposure.",thecryptobasic,https://thecryptobasic.com/2025/07/28/trump-media-invests-300-million-in-bitcoin-linked-derivatives/?utm_source=rss&utm_medium=rss&utm_campaign=trump-media-invests-300-million-in-bitcoin-linked-derivatives,MARKET|BTC|BUSINESS|TRADING|FIAT,Market|Donald Trump and Crypto: News|Latest Bitcoin (BTC) News Today,BTC,"Trump Media Invests $300 Million in Bitcoin-Linked Derivatives. Trump Media and Technology Group (TMTG), the digital media company tied to U.S. President Donald Trump, has made a substantial $300 million investment in Bitcoin-related derivatives. The move, first reported by Bloomberg , marks an escalation of the company''s already aggressive crypto strategy. It now combines traditional holdings with high-risk options linked to exchange-traded funds (ETFs), blockchain equities, and convertible bonds.This allows TMTG to profit from price movements across the crypto sector without increasing its direct Bitcoin stake. It''s a calculated bet on market volatility that could bring significant upside. However, if prices dip, the company could be left with worthless contracts.$2 Billion in Holdings and a Bet on Market TimingEven before this latest investment, TMTG held around $2 billion in Bitcoin and related assets, accounting for roughly two-thirds of its liquid reserves. Now, with the addition of derivatives, the company is embracing a two-pronged strategy. It aims to hedge against short-term price fluctuations while remaining committed to Bitcoin in the long term.Experts Warn of Policy-Market OverlapThe investment has sparked ethical concerns, especially given Trump’s outsize influence in both political and digital spheres. His social media posts on Truth Social have previously moved crypto markets. Most notably, in March, his call for a U.S. Bitcoin reserve sent Bitcoin and Ethereum prices soaring.With TMTG now financially positioned to benefit from such price movements, analysts are warning that the overlap between Trump’s political clout and his business interests could create serious conflicts of interest. “When someone with market-moving power also holds a financial stake, the incentive structure gets murky,” said Steve Sosnick, chief strategist at Interactive Brokers. “Derivatives only amplify that risk.” Nick Carter, a general partner at Castle Island Ventures, echoed those concerns, noting that Trump’s dual roles as a political leader and a crypto-adjacent business figure could distort market conditions if left unchecked.A Broader Pro-Crypto AgendaThe move is not happening in isolation. Trump and his allies have recently ramped up pro-crypto rhetoric, including backing the GENIUS Act and proposing a federally backed Bitcoin reserve. TMTG’s financial moves align with this broader vision, positioning the company at the intersection of political messaging and cryptocurrency strategy.While a handful of public companies hold Bitcoin, few are deploying derivatives at this scale, making TMTG’s approach both unconventional and risk-laden.White House Pushes Back Amid Industry SkepticismIn response to mounting criticism, White House spokesperson Seth Fields stated that “President Trump has never been involved in conflicts of interest and will never be involved.” However, many in the financial community remain unconvinced, citing the unprecedented mix of public influence and private capital exposure."
2025-07-28 14:29:09+00:00,Institutional Investment Could Foster Steadier Bitcoin Growth Toward $150K by Early 2025,"🚀 Are You Chasing New Coins? Catch the newest crypto opportunities. Be the first to buy, be the first to win! Click here to discover new altcoins! Institutional-driven Bitcoin growth",coinotag,https://en.coinotag.com/institutional-investment-could-foster-steadier-bitcoin-growth-toward-150k-by-early-2025/,BTC|ALTCOIN,News|BTC,BTC,"Institutional Investment Could Foster Steadier Bitcoin Growth Toward $150K by Early 2025. 🚀 Are You Chasing New Coins? Catch the newest crypto opportunities. Be the first to buy, be the first to win! Click here to discover new altcoins! Institutional-driven Bitcoin growth"
2025-07-28 14:30:03+00:00,"Citi Analysts Unveil Bitcoin Bull Case Price Target, Say BTC Returns Since 2024 Can Largely Be Explained by One Catalyst Alone: Report","Analysts at banking giant Citi are laying out price targets on Bitcoin ( BTC ) based on a surprisingly simple forecast model. In a new report seen by the Financial Times , Citigroup analysts Alex Saunders and Nathaniel Rupert offer a new way of valuing digital assets, ostensibly suggesting that the price of Bitcoin is influenced simply by how many people want to own it. While Citi’s previous Bitcoin price models incorporated various data inputs like mining electricity costs, adoption rates and more, the analysts have updated their forecast to account for the reality that crypto assets are very much a part of the traditional macroeconomic picture, rather than an isolated subset without relevance to the average investor’s portfolio. “Around the fall of FTX, the majority of client questions were, ‘How does crypto effect MY market or the macroeconomy?’ – the answer then was, probably not much. We think that is changing. Firstly, crypto assets have grown and now represent a more meaningful amount of capital. Crypto market-caps now rival all but the largest-cap equity names. Secondly, crypto-related assets are now meaningful parts of some of the largest financial indices. Crypto-related securities are now members of the S&P 500, Nasdaq, and Russell. Importantly, this means even crypto-agnostic clients need to have a view to manage their portfolios.” Citi now has a “bull case” price target of $199,340 for BTC at the end of this year, a “base case” for $135,133, and a “bear” case for $63,675. Source: Citi/The Financial Times As of late, the analysts say that the price of BTC is primarily driven by one factor. The Citi analysts say that the net weekly flows into Bitcoin-based exchange-traded funds (ETFs) have had a “very strong contemporaneous relationship” with the returns on BTC. “Since launch, 41% of Bitcoin return variation can be explained by flows alone (the relationship is just as strong even accounting for equity returns). So far this year, we have seen just over $19 billion of flows, including $5.5 billion month-to-date. We expect flows to continue for the rest of the year as more institutions approve and potentially advise underlying clients on these vehicles. There is significant uncertainty around these flows; we forecast $15 billion given the pace seen so far year-to-date. This would slightly exceed last year’s launch, but the recent acceleration in flows presents upside risk – given each $1 billion of weekly flows is associated with a 3.6% return increase, flows have a meaningful impact on our forecast.” Follow us on X , Facebook and Telegram Don''t Miss a Beat – Subscribe to get email alerts delivered directly to your inbox Check Price Action Surf The Daily Hodl Mix Disclaimer: Opinions expressed at The Daily Hodl are not investment advice. Investors should do their due diligence before making any high-risk investments in Bitcoin, cryptocurrency or digital assets. Please be advised that your transfers and trades are at your own risk, and any losses you may incur are your responsibility. The Daily Hodl does not recommend the buying or selling of any cryptocurrencies or digital assets, nor is The Daily Hodl an investment advisor. Please note that The Daily Hodl participates in affiliate marketing. Generated Image: DALLE3 The post Citi Analysts Unveil Bitcoin Bull Case Price Target, Say BTC Returns Since 2024 Can Largely Be Explained by One Catalyst Alone: Report appeared first on The Daily Hodl .",dailyhodl,https://dailyhodl.com/2025/07/28/citi-analysts-unveil-bitcoin-bull-case-price-target-say-btc-returns-since-2024-can-largely-be-explained-by-one-catalyst-alone-report/,BTC|TRADING|BUSINESS|MARKET|MINING,Bitcoin|BTC|Citigroup|ETF|exchange-traded funds|News,BTC,"Citi Analysts Unveil Bitcoin Bull Case Price Target, Say BTC Returns Since 2024 Can Largely Be Explained by One Catalyst Alone: Report. Analysts at banking giant Citi are laying out price targets on Bitcoin ( BTC ) based on a surprisingly simple forecast model. In a new report seen by the Financial Times , Citigroup analysts Alex Saunders and Nathaniel Rupert offer a new way of valuing digital assets, ostensibly suggesting that the price of Bitcoin is influenced simply by how many people want to own it. While Citi’s previous Bitcoin price models incorporated various data inputs like mining electricity costs, adoption rates and more, the analysts have updated their forecast to account for the reality that crypto assets are very much a part of the traditional macroeconomic picture, rather than an isolated subset without relevance to the average investor’s portfolio. “Around the fall of FTX, the majority of client questions were, ‘How does crypto effect MY market or the macroeconomy?’ – the answer then was, probably not much. We think that is changing. Firstly, crypto assets have grown and now represent a more meaningful amount of capital. Crypto market-caps now rival all but the largest-cap equity names. Secondly, crypto-related assets are now meaningful parts of some of the largest financial indices. Crypto-related securities are now members of the S&P 500, Nasdaq, and Russell. Importantly, this means even crypto-agnostic clients need to have a view to manage their portfolios.” Citi now has a “bull case” price target of $199,340 for BTC at the end of this year, a “base case” for $135,133, and a “bear” case for $63,675. Source: Citi/The Financial Times As of late, the analysts say that the price of BTC is primarily driven by one factor. The Citi analysts say that the net weekly flows into Bitcoin-based exchange-traded funds (ETFs) have had a “very strong contemporaneous relationship” with the returns on BTC. “Since launch, 41% of Bitcoin return variation can be explained by flows alone (the relationship is just as strong even accounting for equity returns). So far this year, we have seen just over $19 billion of flows, including $5.5 billion month-to-date. We expect flows to continue for the rest of the year as more institutions approve and potentially advise underlying clients on these vehicles. There is significant uncertainty around these flows; we forecast $15 billion given the pace seen so far year-to-date. This would slightly exceed last year’s launch, but the recent acceleration in flows presents upside risk – given each $1 billion of weekly flows is associated with a 3.6% return increase, flows have a meaningful impact on our forecast.” Follow us on X , Facebook and Telegram Don''t Miss a Beat – Subscribe to get email alerts delivered directly to your inbox Check Price Action Surf The Daily Hodl Mix Disclaimer: Opinions expressed at The Daily Hodl are not investment advice. Investors should do their due diligence before making any high-risk investments in Bitcoin, cryptocurrency or digital assets. Please be advised that your transfers and trades are at your own risk, and any losses you may incur are your responsibility. The Daily Hodl does not recommend the buying or selling of any cryptocurrencies or digital assets, nor is The Daily Hodl an investment advisor. Please note that The Daily Hodl participates in affiliate marketing. Generated Image: DALLE3 The post Citi Analysts Unveil Bitcoin Bull Case Price Target, Say BTC Returns Since 2024 Can Largely Be Explained by One Catalyst Alone: Report appeared first on The Daily Hodl ."
2025-07-28 14:30:34+00:00,Crypto Debate Heats Up As US Lawmakers Question FHFA Home Loan Policy,"A new political debate is unfolding as a group of Senate Democrats has officially raised concerns about the growing intersection of crypto and the US housing market. The lawmakers sent a letter to William Pulte, Director of the Federal Housing Finance Agency (FHFA), challenging his recent directive that asks Fannie Mae and Freddie Mac to submit proposals for including unconverted cryptocurrency assets in mortgage underwriting decisions. This marks a potential shift in how digital assets could influence loan eligibility and financial risk assessments. The senators—led by Jeff Merkley, Elizabeth Warren, and Bernie Sanders—warn that the inclusion of volatile and largely unregulated crypto holdings in underwriting processes may pose significant dangers to consumers and the broader housing market. They argue the directive lacks sufficient detail on how these proposals will be developed, evaluated, or regulated, creating uncertainty and possible systemic risks. Under current rules, only converted crypto with proper documentation can be considered in mortgage applications. Including unconverted assets, critics say, opens the door to volatility , liquidity risks, and potential loss from scams or hacks. With Pulte also chairing the boards of Fannie Mae and Freddie Mac, questions around conflict of interest and procedural oversight are intensifying. Senators Raise Red Flags Over Crypto In Mortgage Underwriting In their sharply worded letter, the senators highlighted that current federal guidelines prohibit the use of unconverted cryptocurrency in mortgage underwriting. “Expanding underwriting criteria to include the consideration of unconverted cryptocurrency assets could pose risks to the stability of the housing market and the financial system,” the senators warned. They argue that crypto’s volatility, lack of regulatory clarity, and limited liquidity—especially during market downturns—could amplify risks for both lenders and borrowers. As the letter notes, “a borrower using crypto faces an increased risk that they may not be able to exit a crypto position and convert to cash at a price that would allow them to buffer against risk of mortgage default.” The lawmakers argue that the recent directive from FHFA Director William Pulte could disrupt the financial system’s stability by enabling lenders to consider unconverted crypto assets—assets that are volatile, hard to value in real-time, and prone to liquidity constraints. Beyond financial concerns, the senators also questioned potential conflicts of interest between Pulte, the Trump Administration, and the cryptocurrency industry, particularly regarding his dual role as FHFA Director and Chair of the Enterprises’ Boards. These overlapping positions could allow for outsized influence in approving policies that lack independent scrutiny. As the US inches closer to integrating this asset class into traditional financial frameworks, this letter signals intensifying scrutiny from lawmakers. With institutional adoption growing and regulatory frameworks evolving, the coming weeks will be crucial for determining how the US government balances innovation with systemic financial stability. Total Market Cap Approaches $4 Trillion The weekly chart of the total crypto market cap reveals a powerful uptrend, with the market currently sitting at $3.89 trillion—just shy of the psychological $4 trillion mark. After a steep rally that began in late 2023, the market has continued to push higher with strong bullish momentum, confirming a breakout from its previous consolidation phase. All major moving averages (50, 100, and 200) are trending upward, and the price remains well above them. This suggests a healthy structure in both short- and long-term perspectives. The 50-week SMA at $2.95 trillion is now acting as solid macro support, underlining the strength of the current cycle. Notably, this level also aligns with the prior all-time high region from early 2022, now flipped into support—an important technical signal in bullish cycles. Volume is increasing in the up weeks, confirming buying interest as the market gains traction. Featured image from Dall-E, chart from TradingView",bitcoinist,https://bitcoinist.com/us-lawmakers-question-fhfas-push-include-crypto/,ETH|MARKET|BTC|FIAT|ADA|TRADING|DOGE|REGULATION|ALTCOIN|BUSINESS|BLOCKCHAIN|ZRX|TOKEN SALE|XRP|TREASURY|SPONSORED|SOL|EXCHANGE|BNB|USDT|ALGO|BCH|PYUSD|TRX|FORKS|RESEARCH|ASIA|TECHNOLOGY|MINING|PEPE|USDC|SHIB|BITTENSOR|WALLET|ARKM|BONK|AIRDROP|XLM|LTC|CFX|FLOKI|MX|COMMODITY|ONDO|ENA|GALA,Crypto News|crypto|Crypto Home Loans|crypto news|Crypto Regulations|total crypto market cap|US crypto adoption|US crypto regulation|us lawmakers,BTC,"Crypto Debate Heats Up As US Lawmakers Question FHFA Home Loan Policy. A new political debate is unfolding as a group of Senate Democrats has officially raised concerns about the growing intersection of crypto and the US housing market. The lawmakers sent a letter to William Pulte, Director of the Federal Housing Finance Agency (FHFA), challenging his recent directive that asks Fannie Mae and Freddie Mac to submit proposals for including unconverted cryptocurrency assets in mortgage underwriting decisions. This marks a potential shift in how digital assets could influence loan eligibility and financial risk assessments. The senators—led by Jeff Merkley, Elizabeth Warren, and Bernie Sanders—warn that the inclusion of volatile and largely unregulated crypto holdings in underwriting processes may pose significant dangers to consumers and the broader housing market. They argue the directive lacks sufficient detail on how these proposals will be developed, evaluated, or regulated, creating uncertainty and possible systemic risks. Under current rules, only converted crypto with proper documentation can be considered in mortgage applications. Including unconverted assets, critics say, opens the door to volatility , liquidity risks, and potential loss from scams or hacks. With Pulte also chairing the boards of Fannie Mae and Freddie Mac, questions around conflict of interest and procedural oversight are intensifying. Senators Raise Red Flags Over Crypto In Mortgage Underwriting In their sharply worded letter, the senators highlighted that current federal guidelines prohibit the use of unconverted cryptocurrency in mortgage underwriting. “Expanding underwriting criteria to include the consideration of unconverted cryptocurrency assets could pose risks to the stability of the housing market and the financial system,” the senators warned. They argue that crypto’s volatility, lack of regulatory clarity, and limited liquidity—especially during market downturns—could amplify risks for both lenders and borrowers. As the letter notes, “a borrower using crypto faces an increased risk that they may not be able to exit a crypto position and convert to cash at a price that would allow them to buffer against risk of mortgage default.” The lawmakers argue that the recent directive from FHFA Director William Pulte could disrupt the financial system’s stability by enabling lenders to consider unconverted crypto assets—assets that are volatile, hard to value in real-time, and prone to liquidity constraints. Beyond financial concerns, the senators also questioned potential conflicts of interest between Pulte, the Trump Administration, and the cryptocurrency industry, particularly regarding his dual role as FHFA Director and Chair of the Enterprises’ Boards. These overlapping positions could allow for outsized influence in approving policies that lack independent scrutiny. As the US inches closer to integrating this asset class into traditional financial frameworks, this letter signals intensifying scrutiny from lawmakers. With institutional adoption growing and regulatory frameworks evolving, the coming weeks will be crucial for determining how the US government balances innovation with systemic financial stability. Total Market Cap Approaches $4 Trillion The weekly chart of the total crypto market cap reveals a powerful uptrend, with the market currently sitting at $3.89 trillion—just shy of the psychological $4 trillion mark. After a steep rally that began in late 2023, the market has continued to push higher with strong bullish momentum, confirming a breakout from its previous consolidation phase. All major moving averages (50, 100, and 200) are trending upward, and the price remains well above them. This suggests a healthy structure in both short- and long-term perspectives. The 50-week SMA at $2.95 trillion is now acting as solid macro support, underlining the strength of the current cycle. Notably, this level also aligns with the prior all-time high region from early 2022, now flipped into support—an important technical signal in bullish cycles. Volume is increasing in the up weeks, confirming buying interest as the market gains traction. Featured image from Dall-E, chart from TradingView"
