DATETIME,HEADLINE,SUMMARY,SOURCE,URL,CATEGORIES,TAGS,asset,text
2025-07-24 07:55:18+00:00,Crypto Pullback: Unraveling the Market’s Sudden Plunge,"BitcoinWorld Crypto Pullback: Unraveling the Market’s Sudden Plunge The cryptocurrency market, known for its exhilarating highs and stomach-churning lows, recently experienced a notable dip that left many investors scratching their heads. Was it a fundamental flaw, a regulatory hammer, or something else entirely? The consensus among analysts points towards a less dramatic, yet equally impactful, set of forces: short-term profit-taking and a cascade of leveraged liquidations. This recent crypto pullback , while unsettling for some, offers valuable insights into the inherent dynamics of this rapidly evolving financial landscape. What Triggered the Recent Crypto Pullback? When the market takes a sudden turn, the immediate instinct is often to search for a definitive cause – a major news event, a regulatory announcement, or a macroeconomic shift. However, according to reports from The Block, citing multiple analysts, the recent crypto pullback was not propelled by any singular, clear catalyst. Instead, it appears to be a natural consequence of market mechanics and investor behavior. Min Jung, an analyst at Presto Research, characterized the decline as a ‘natural pause’ following a period of significant gains. To put this into perspective, consider the performance of major altcoins just before the dip: Ethereum (ETH): Saw a commendable 7% rise over the preceding week. Dogecoin (DOGE): Experienced an even more impressive 12% surge within the same timeframe. Such rapid ascents often precede periods of consolidation or correction as early investors look to secure their profits. This is a classic market phenomenon: what goes up quickly often sees a temporary reversal as participants take some chips off the table. Adding another layer to this explanation, Vincent Liu, CIO of Kronos Research, pointed to two critical factors: Over-leveraged Altcoin Positions: Many traders had opened positions, particularly in altcoins, using borrowed funds (leverage). While leverage can amplify gains, it also dramatically magnifies losses. Thinning Liquidity: This refers to a market condition where there are fewer buyers and sellers, making it harder to execute large trades without significantly impacting the price. When liquidity thins, even relatively small sell orders can trigger disproportionately large price drops. Together, these factors created a fertile ground for a sharp downturn, transforming what might have been a minor correction into a more pronounced crypto pullback . Understanding the Mechanics: Profit-Taking vs. Liquidations To truly grasp the recent market movements, it’s essential to differentiate between profit-taking and liquidations, as both played crucial roles in the crypto pullback . Profit-Taking: Cashing In on Gains Profit-taking is a straightforward concept. When an asset’s price rises significantly, investors who bought at lower prices decide to sell a portion or all of their holdings to realize their gains. This is a healthy and normal part of any market cycle. After assets like Ethereum and Dogecoin experienced substantial weekly rallies, it was almost inevitable that some investors would choose to lock in those profits. This selling pressure, while organic, contributes to downward price momentum. Liquidations: The Domino Effect of Leverage Liquidations are far more impactful and often lead to sharper, more volatile drops. They occur when traders use leverage – borrowing funds to increase their exposure to an asset. While leverage can amplify returns, it also comes with a significant risk: if the market moves against a leveraged position, the trader’s collateral might fall below a certain threshold (known as the maintenance margin). At this point, exchanges automatically close (liquidate) the position to prevent further losses to the lender. Here’s how liquidations contribute to a cascading effect during a crypto pullback : Initial Price Drop: A small price decline (perhaps due to profit-taking) pushes some leveraged positions towards their liquidation price. Forced Selling: As these positions are liquidated, the exchange sells the underlying assets, adding more selling pressure to the market. Further Price Drop: This increased selling drives prices down even further, triggering more liquidations, creating a negative feedback loop. Market Instability: This cascade can lead to rapid and dramatic price crashes, even without a major fundamental shift in the asset’s value. The combination of investors deliberately selling for profit and the forced selling from liquidations creates a powerful downward force that can quickly turn a minor dip into a significant crypto pullback . The Role of Altcoins and Liquidity in the Crypto Pullback While Bitcoin often sets the tone for the broader market, altcoins frequently exhibit higher volatility and can amplify market movements. This was evident in the recent crypto pullback , where altcoin positions were particularly susceptible. Altcoin Vulnerability Altcoins, generall",bitcoinworld,https://bitcoinworld.co.in/crypto-pullback-market-plunge/,MARKET|TRADING|BUSINESS|ALTCOIN|BTC,Crypto News|ALTCOINS|crypto pullback|Liquidations|Market Analysis|Profit-taking,BTC,"Crypto Pullback: Unraveling the Market’s Sudden Plunge. BitcoinWorld Crypto Pullback: Unraveling the Market’s Sudden Plunge The cryptocurrency market, known for its exhilarating highs and stomach-churning lows, recently experienced a notable dip that left many investors scratching their heads. Was it a fundamental flaw, a regulatory hammer, or something else entirely? The consensus among analysts points towards a less dramatic, yet equally impactful, set of forces: short-term profit-taking and a cascade of leveraged liquidations. This recent crypto pullback , while unsettling for some, offers valuable insights into the inherent dynamics of this rapidly evolving financial landscape. What Triggered the Recent Crypto Pullback? When the market takes a sudden turn, the immediate instinct is often to search for a definitive cause – a major news event, a regulatory announcement, or a macroeconomic shift. However, according to reports from The Block, citing multiple analysts, the recent crypto pullback was not propelled by any singular, clear catalyst. Instead, it appears to be a natural consequence of market mechanics and investor behavior. Min Jung, an analyst at Presto Research, characterized the decline as a ‘natural pause’ following a period of significant gains. To put this into perspective, consider the performance of major altcoins just before the dip: Ethereum (ETH): Saw a commendable 7% rise over the preceding week. Dogecoin (DOGE): Experienced an even more impressive 12% surge within the same timeframe. Such rapid ascents often precede periods of consolidation or correction as early investors look to secure their profits. This is a classic market phenomenon: what goes up quickly often sees a temporary reversal as participants take some chips off the table. Adding another layer to this explanation, Vincent Liu, CIO of Kronos Research, pointed to two critical factors: Over-leveraged Altcoin Positions: Many traders had opened positions, particularly in altcoins, using borrowed funds (leverage). While leverage can amplify gains, it also dramatically magnifies losses. Thinning Liquidity: This refers to a market condition where there are fewer buyers and sellers, making it harder to execute large trades without significantly impacting the price. When liquidity thins, even relatively small sell orders can trigger disproportionately large price drops. Together, these factors created a fertile ground for a sharp downturn, transforming what might have been a minor correction into a more pronounced crypto pullback . Understanding the Mechanics: Profit-Taking vs. Liquidations To truly grasp the recent market movements, it’s essential to differentiate between profit-taking and liquidations, as both played crucial roles in the crypto pullback . Profit-Taking: Cashing In on Gains Profit-taking is a straightforward concept. When an asset’s price rises significantly, investors who bought at lower prices decide to sell a portion or all of their holdings to realize their gains. This is a healthy and normal part of any market cycle. After assets like Ethereum and Dogecoin experienced substantial weekly rallies, it was almost inevitable that some investors would choose to lock in those profits. This selling pressure, while organic, contributes to downward price momentum. Liquidations: The Domino Effect of Leverage Liquidations are far more impactful and often lead to sharper, more volatile drops. They occur when traders use leverage – borrowing funds to increase their exposure to an asset. While leverage can amplify returns, it also comes with a significant risk: if the market moves against a leveraged position, the trader’s collateral might fall below a certain threshold (known as the maintenance margin). At this point, exchanges automatically close (liquidate) the position to prevent further losses to the lender. Here’s how liquidations contribute to a cascading effect during a crypto pullback : Initial Price Drop: A small price decline (perhaps due to profit-taking) pushes some leveraged positions towards their liquidation price. Forced Selling: As these positions are liquidated, the exchange sells the underlying assets, adding more selling pressure to the market. Further Price Drop: This increased selling drives prices down even further, triggering more liquidations, creating a negative feedback loop. Market Instability: This cascade can lead to rapid and dramatic price crashes, even without a major fundamental shift in the asset’s value. The combination of investors deliberately selling for profit and the forced selling from liquidations creates a powerful downward force that can quickly turn a minor dip into a significant crypto pullback . The Role of Altcoins and Liquidity in the Crypto Pullback While Bitcoin often sets the tone for the broader market, altcoins frequently exhibit higher volatility and can amplify market movements. This was evident in the recent crypto pullback , where altcoin positions were particularly susceptible. Altcoin Vulnerability Altcoins, generall"
2025-07-24 08:00:15+00:00,Bitcoin Consolidates Below $120K as Exchange Activity Reflects Mixed Market Signals,"Bitcoin continues to hover below its all-time high, with current trading levels near $118,000 reflecting a 0.6% daily drop and a 3.8% pullback from the peak above $123,000 recorded earlier this month. While the broader trend remains uncertain, analysts have assessed on-chain activity for signs of the next major move. Recent data from CryptoQuant analysts highlights a divide between retail and institutional behavior across leading exchanges, raising questions about potential profit-taking or strategic accumulation. Related Reading: Bitcoin Must Defend This Key Support For $180,000 Year-End Target, Analyst Says Bitcoin Retail Traders Sell into Strength, While Whales Accumulate On the one hand, short-term holder (STH) behavior on Binance suggests some market participants are opting to take profits following the asset’s strong rally. On the other hand, Kraken has recorded a sharp outflow of Bitcoin, a movement typically associated with whale activity or long-term accumulation. This contrasting activity across platforms suggests a split in market sentiment, with retail traders potentially trimming their exposure and larger players preparing for sustained upside. According to CryptoQuant analyst Amr Taha, the Binance Exchange Inflow Ratio for Short-Term Holders recently crossed the 0.4 level, historically linked to increased retail selling pressure. These STHs, who typically hold Bitcoin for fewer than 155 days, tend to deposit funds to exchanges during periods of price strength to lock in gains. The spike above this threshold may indicate a growing tendency among retail investors to exit positions in anticipation of volatility. In contrast, the same analysis pointed to significant outflows from Kraken, with over 9,600 BTC withdrawn on July 22, one of the highest single-day outflows seen in recent months. Taha interpreted this as a potential signal of whale accumulation, with institutional or high-net-worth participants removing assets from exchange custody, often in preparation for long-term storage. This divergence in behavior between Binance and Kraken highlights the differing strategies employed by market segments, with retail users leaning toward short-term positioning and whales opting for long-term accumulation. Binance Reserve Trends Highlight Strengthening Profit Margins Adding another layer to the evolving market picture, CryptoQuant analyst Darkfost shared that Binance’s unrealized profit on its Bitcoin reserves has hit an all-time high of approximately 60,000 BTC. This figure has grown despite a gradual decline in total BTC reserves held on the platform, which have fallen from 631,000 BTC in September 2024 to 574,000 BTC as of now. A portion of these holdings, around 16,000 BTC, is locked in custodial wallets to back the BTCB token on the BNB Chain, serving operational purposes. Darkfost emphasized that decreasing exchange reserves are often interpreted as a sign of investor confidence, reflecting a preference to store Bitcoin in personal wallets rather than leaving it on centralized platforms. Related Reading: Trump Media’s $2 Billion Bitcoin Buy Sparks Surge In Stock Price The rise in unrealized profit amid falling reserves may indicate that while outflows persist, the remaining holdings have appreciated significantly in value, highlighting the platform’s strengthened position. Featured image created with DALL-E, Chart from TradingView",newsbtc,https://www.newsbtc.com/bitcoin-news/bitcoin-consolidates-below-120k-as-exchange-activity-reflects-mixed-market-signals/,BTC|EXCHANGE|MARKET|BNB|BUSINESS,Bitcoin News|bitcoin|bitcoin market|btc|BTCUSDT|crypto market|cryptocurrency|cryptoquant,BTC,"Bitcoin Consolidates Below $120K as Exchange Activity Reflects Mixed Market Signals. Bitcoin continues to hover below its all-time high, with current trading levels near $118,000 reflecting a 0.6% daily drop and a 3.8% pullback from the peak above $123,000 recorded earlier this month. While the broader trend remains uncertain, analysts have assessed on-chain activity for signs of the next major move. Recent data from CryptoQuant analysts highlights a divide between retail and institutional behavior across leading exchanges, raising questions about potential profit-taking or strategic accumulation. Related Reading: Bitcoin Must Defend This Key Support For $180,000 Year-End Target, Analyst Says Bitcoin Retail Traders Sell into Strength, While Whales Accumulate On the one hand, short-term holder (STH) behavior on Binance suggests some market participants are opting to take profits following the asset’s strong rally. On the other hand, Kraken has recorded a sharp outflow of Bitcoin, a movement typically associated with whale activity or long-term accumulation. This contrasting activity across platforms suggests a split in market sentiment, with retail traders potentially trimming their exposure and larger players preparing for sustained upside. According to CryptoQuant analyst Amr Taha, the Binance Exchange Inflow Ratio for Short-Term Holders recently crossed the 0.4 level, historically linked to increased retail selling pressure. These STHs, who typically hold Bitcoin for fewer than 155 days, tend to deposit funds to exchanges during periods of price strength to lock in gains. The spike above this threshold may indicate a growing tendency among retail investors to exit positions in anticipation of volatility. In contrast, the same analysis pointed to significant outflows from Kraken, with over 9,600 BTC withdrawn on July 22, one of the highest single-day outflows seen in recent months. Taha interpreted this as a potential signal of whale accumulation, with institutional or high-net-worth participants removing assets from exchange custody, often in preparation for long-term storage. This divergence in behavior between Binance and Kraken highlights the differing strategies employed by market segments, with retail users leaning toward short-term positioning and whales opting for long-term accumulation. Binance Reserve Trends Highlight Strengthening Profit Margins Adding another layer to the evolving market picture, CryptoQuant analyst Darkfost shared that Binance’s unrealized profit on its Bitcoin reserves has hit an all-time high of approximately 60,000 BTC. This figure has grown despite a gradual decline in total BTC reserves held on the platform, which have fallen from 631,000 BTC in September 2024 to 574,000 BTC as of now. A portion of these holdings, around 16,000 BTC, is locked in custodial wallets to back the BTCB token on the BNB Chain, serving operational purposes. Darkfost emphasized that decreasing exchange reserves are often interpreted as a sign of investor confidence, reflecting a preference to store Bitcoin in personal wallets rather than leaving it on centralized platforms. Related Reading: Trump Media’s $2 Billion Bitcoin Buy Sparks Surge In Stock Price The rise in unrealized profit amid falling reserves may indicate that while outflows persist, the remaining holdings have appreciated significantly in value, highlighting the platform’s strengthened position. Featured image created with DALL-E, Chart from TradingView"
2025-07-24 08:01:54+00:00,"U.S. Government Bitcoin Holdings May Remain Near 198,000 BTC Despite FOIA Disclosure Limitations","🚀 Are You Chasing New Coins? Catch the newest crypto opportunities. Be the first to buy, be the first to win! Click here to discover new altcoins! The U.S. government’s",coinotag,https://en.coinotag.com/u-s-government-bitcoin-holdings-may-remain-near-198000-btc-despite-foia-disclosure-limitations/,BTC|ARKM|FTT|MARKET|ALTCOIN,Analysis|Bitcoin|News|ARKM|BTC|FTT,BTC,"U.S. Government Bitcoin Holdings May Remain Near 198,000 BTC Despite FOIA Disclosure Limitations. 🚀 Are You Chasing New Coins? Catch the newest crypto opportunities. Be the first to buy, be the first to win! Click here to discover new altcoins! The U.S. government’s"
2025-07-24 08:06:51+00:00,Why Has Crypto Dropped Today?,"The post Why Has Crypto Dropped Today? appeared first on Coinpedia Fintech News The crypto market just saw a big drop, wiping out more than $130 billion in a single day. After weeks of strong gains, this sharp pullback has left many traders asking one big question: Why is the market crashing now? Many see this drop as a mix of profit-taking, big liquidations, and weak ETF interest. Let’s break it down. Profit-Taking Kicked Things Off The crash began with many traders cashing in on recent gains. Bitcoin had jumped nearly 17% in the past month, pulling altcoins up along with it. After such a strong rally, it was natural for some investors to lock in profits. This wave of selling added pressure across the board, especially on altcoins. In just one day, the total crypto market dropped by 3.3%, but altcoins fell even harder. XRP plunged 12.4%, DOGE lost 14%, and PEPE dropped 13.5% — showing how quickly gains can vanish when traders rush to sell. ETF Inflows Are Slowing Down On top of profit-taking, institutional buying has slowed down too. The Spot Bitcoin ETFs saw three straight days of outflows, with $85.8 million leaving the market on July 23 alone. Fidelity led the charge, followed by ARK Invest and Bitwise. Meanwhile, Ethereum ETFs are also cooling off. Inflows fell to $332 million, down sharply from $726 million the previous week. This slowdown suggests big players are waiting on the sidelines before placing new bets. Liquidations Hit Traders Hard Another big reason for the drop was the huge liquidation of leveraged positions. In the last 24 hours, over 314,000 traders were liquidated, wiping out $968 million , mostly from long trades. Bitcoin’s fall below $118,000 triggered a chain reaction of stop-losses and forced selling. Ethereum saw nearly $195 million in liquidations, while XRP faced $113 million, showing how quickly high leverage can lead to a deep market flush. SEC Pause and Fed Decision Add Worries Adding to the nerves, the SEC decided to pause Bitwise’s new crypto index ETF. Many people thought this ETF would launch soon and bring fresh money into crypto. The reason? XRP’s ongoing legal issues. SEC’s Bitwise ETF “Pause” — Orchestrated? First, they approve it. Then they slam the brakes. Who benefits from confusion while XRP’s rails are being loaded by institutions? The same elite who don’t want you front-running the reset. Question everything. pic.twitter.com/48cs7w7Wy7 — Pumpius (@pumpius) July 23, 2025 On top of that, traders are waiting for the White House’s crypto report and the Federal Reserve’s next interest rate decision, both coming on July 30. Is A Recovery Next? Even with this big red day, many experts believe this is just a healthy break after a strong rally. Bitcoin bounced back to around $119,000 after dipping near $117,000. Some altcoins have already started to climb again.",coinpedia,https://coinpedia.org/news/why-has-crypto-dropped-today/,MARKET|ALTCOIN|BTC|REGULATION|XRP,News,BTC,"Why Has Crypto Dropped Today?. The post Why Has Crypto Dropped Today? appeared first on Coinpedia Fintech News The crypto market just saw a big drop, wiping out more than $130 billion in a single day. After weeks of strong gains, this sharp pullback has left many traders asking one big question: Why is the market crashing now? Many see this drop as a mix of profit-taking, big liquidations, and weak ETF interest. Let’s break it down. Profit-Taking Kicked Things Off The crash began with many traders cashing in on recent gains. Bitcoin had jumped nearly 17% in the past month, pulling altcoins up along with it. After such a strong rally, it was natural for some investors to lock in profits. This wave of selling added pressure across the board, especially on altcoins. In just one day, the total crypto market dropped by 3.3%, but altcoins fell even harder. XRP plunged 12.4%, DOGE lost 14%, and PEPE dropped 13.5% — showing how quickly gains can vanish when traders rush to sell. ETF Inflows Are Slowing Down On top of profit-taking, institutional buying has slowed down too. The Spot Bitcoin ETFs saw three straight days of outflows, with $85.8 million leaving the market on July 23 alone. Fidelity led the charge, followed by ARK Invest and Bitwise. Meanwhile, Ethereum ETFs are also cooling off. Inflows fell to $332 million, down sharply from $726 million the previous week. This slowdown suggests big players are waiting on the sidelines before placing new bets. Liquidations Hit Traders Hard Another big reason for the drop was the huge liquidation of leveraged positions. In the last 24 hours, over 314,000 traders were liquidated, wiping out $968 million , mostly from long trades. Bitcoin’s fall below $118,000 triggered a chain reaction of stop-losses and forced selling. Ethereum saw nearly $195 million in liquidations, while XRP faced $113 million, showing how quickly high leverage can lead to a deep market flush. SEC Pause and Fed Decision Add Worries Adding to the nerves, the SEC decided to pause Bitwise’s new crypto index ETF. Many people thought this ETF would launch soon and bring fresh money into crypto. The reason? XRP’s ongoing legal issues. SEC’s Bitwise ETF “Pause” — Orchestrated? First, they approve it. Then they slam the brakes. Who benefits from confusion while XRP’s rails are being loaded by institutions? The same elite who don’t want you front-running the reset. Question everything. pic.twitter.com/48cs7w7Wy7 — Pumpius (@pumpius) July 23, 2025 On top of that, traders are waiting for the White House’s crypto report and the Federal Reserve’s next interest rate decision, both coming on July 30. Is A Recovery Next? Even with this big red day, many experts believe this is just a healthy break after a strong rally. Bitcoin bounced back to around $119,000 after dipping near $117,000. Some altcoins have already started to climb again."
2025-07-24 08:09:16+00:00,U.S. and EU May Reach 15% Tariff Agreement Amid Potential Market Impact on Bitcoin,"🚀 Are You Chasing New Coins? Catch the newest crypto opportunities. Be the first to buy, be the first to win! Click here to discover new altcoins! The United States",coinotag,https://en.coinotag.com/u-s-and-eu-may-reach-15-tariff-agreement-amid-potential-market-impact-on-bitcoin/,BTC|ETH|MARKET|ALTCOIN,Bitcoin|Ethereum|News|BTC|ETH,BTC,"U.S. and EU May Reach 15% Tariff Agreement Amid Potential Market Impact on Bitcoin. 🚀 Are You Chasing New Coins? Catch the newest crypto opportunities. Be the first to buy, be the first to win! Click here to discover new altcoins! The United States"
