DATETIME,HEADLINE,SUMMARY,SOURCE,URL,CATEGORIES,TAGS,asset,text
2025-07-23 23:30:09+00:00,Time Traveler Says Do Nothing With XRP Until 2030. Here’s why,"A prominent member of the XRP community, known as “Time Traveler,” recently advised investors to refrain from any activity involving their XRP tokens until 2030. The statement, shared on X, generated substantial discussion among XRP supporters. In a follow-up post, Traveler clarified that his position is based on a strong belief in XRP’s long-term value and that holders should refrain from selling, regardless of short-term price fluctuations or external developments. A Long-Term Strategy for XRP Traveler’s stance reflects a broader sentiment gaining traction within the XRP community, that significant value appreciation is more likely to occur over the long term. His message discourages any form of premature selling, especially in response to temporary price spikes or market events. This is financial advice. Do nothing with XRP until 2030. — 𝚃𝚒𝚖𝚎 𝚃𝚛𝚊𝚟𝚎𝚕𝚎𝚛 (@Traveler2236) July 22, 2025 This perspective aligns with the growing narrative that XRP’s role in the future of digital finance, particularly in cross-border payments and tokenized asset settlement, could drive substantial price appreciation by the end of the decade. Several market analysts and community figures have issued forecasts that support this long-hold strategy. Analyst Forecasts Support the 2030 Outlook Price predictions for XRP in the coming years further reinforce the logic behind a long-term hold. Analysts at Changelly, for example, forecast that XRP may start the year 2030 at around $19.21 and could reach up to $32.60 by year-end. If that projection holds, an investor holding 10,000 XRP today, currently valued at $32,900 at $3.29, could potentially see that investment rise to $326,000 by 2030. Telegaon, another forecasting platform, offers an even more optimistic scenario. Their analysts estimate that XRP could trade between $36.86 and $48.03 by 2030. At the higher end of that range, the same 10,000 tokens would be worth approximately $480,000, translating to a gain of $447,400 on today’s valuation. Influential Community Voices Weigh In Time Traveler is not alone in advocating for a long-term holding approach. Other figures in the XRP space have issued similar warnings against selling too early. Edoardo Farina, another community advocate, recently cautioned that selling XRP at $10 could be a major missed opportunity. He emphasized that even large-scale disruptions such as geopolitical conflict or economic downturns would not dissuade him from holding until a $100 valuation is reached. We are on twitter, follow us to connect with us :- @TimesTabloid1 — TimesTabloid (@TimesTabloid1) July 15, 2023 Another anonymous XRP enthusiast warned that most holders are likely to exit their positions prematurely, between $10 and $20, before XRP realizes its full potential. According to this individual, XRP may eventually decouple from Bitcoin’s influence, which could lead to independent and sustained growth in its market value. While some voices promote holding through 2030 without taking profits, others offer a more conservative strategy. EGRAG Crypto, a well-followed analyst in the space, has advised a gradual profit-taking approach. He argues that locking in gains incrementally, rather than waiting for a single price peak, allows investors to reduce risk while still benefiting from future appreciation. This strategy can help mitigate potential losses in the event of a market correction and ensure that investors do not miss opportunities to realize returns during XRP’s rise. The current debate within the XRP community highlights two distinct schools of thought, one advocating for long-term patience and another promoting strategic exits. There is no certainty that XRP will reach $20, $100, or beyond by 2030. However, with multiple analysts projecting considerable upside, many investors are choosing to remain committed for the long haul. Disclaimer : This content is meant to inform and should not be considered financial advice. The views expressed in this article may include the author’s personal opinions and do not represent Times Tabloid’s opinion. Readers are urged to do in-depth research before making any investment decisions. Any action taken by the reader is strictly at their own risk. Times Tabloid is not responsible for any financial losses. Follow us on Twitter , Facebook , Telegram , and Google News The post Time Traveler Says Do Nothing With XRP Until 2030. Here’s why appeared first on Times Tabloid .",timestabloid,https://timestabloid.com/time-traveler-says-do-nothing-with-xrp-until-2030-heres-why/,XRP|BUSINESS|TRADING|MARKET|BTC,Cryptocurrency|News|XRP,BTC,"Time Traveler Says Do Nothing With XRP Until 2030. Here’s why. A prominent member of the XRP community, known as “Time Traveler,” recently advised investors to refrain from any activity involving their XRP tokens until 2030. The statement, shared on X, generated substantial discussion among XRP supporters. In a follow-up post, Traveler clarified that his position is based on a strong belief in XRP’s long-term value and that holders should refrain from selling, regardless of short-term price fluctuations or external developments. A Long-Term Strategy for XRP Traveler’s stance reflects a broader sentiment gaining traction within the XRP community, that significant value appreciation is more likely to occur over the long term. His message discourages any form of premature selling, especially in response to temporary price spikes or market events. This is financial advice. Do nothing with XRP until 2030. — 𝚃𝚒𝚖𝚎 𝚃𝚛𝚊𝚟𝚎𝚕𝚎𝚛 (@Traveler2236) July 22, 2025 This perspective aligns with the growing narrative that XRP’s role in the future of digital finance, particularly in cross-border payments and tokenized asset settlement, could drive substantial price appreciation by the end of the decade. Several market analysts and community figures have issued forecasts that support this long-hold strategy. Analyst Forecasts Support the 2030 Outlook Price predictions for XRP in the coming years further reinforce the logic behind a long-term hold. Analysts at Changelly, for example, forecast that XRP may start the year 2030 at around $19.21 and could reach up to $32.60 by year-end. If that projection holds, an investor holding 10,000 XRP today, currently valued at $32,900 at $3.29, could potentially see that investment rise to $326,000 by 2030. Telegaon, another forecasting platform, offers an even more optimistic scenario. Their analysts estimate that XRP could trade between $36.86 and $48.03 by 2030. At the higher end of that range, the same 10,000 tokens would be worth approximately $480,000, translating to a gain of $447,400 on today’s valuation. Influential Community Voices Weigh In Time Traveler is not alone in advocating for a long-term holding approach. Other figures in the XRP space have issued similar warnings against selling too early. Edoardo Farina, another community advocate, recently cautioned that selling XRP at $10 could be a major missed opportunity. He emphasized that even large-scale disruptions such as geopolitical conflict or economic downturns would not dissuade him from holding until a $100 valuation is reached. We are on twitter, follow us to connect with us :- @TimesTabloid1 — TimesTabloid (@TimesTabloid1) July 15, 2023 Another anonymous XRP enthusiast warned that most holders are likely to exit their positions prematurely, between $10 and $20, before XRP realizes its full potential. According to this individual, XRP may eventually decouple from Bitcoin’s influence, which could lead to independent and sustained growth in its market value. While some voices promote holding through 2030 without taking profits, others offer a more conservative strategy. EGRAG Crypto, a well-followed analyst in the space, has advised a gradual profit-taking approach. He argues that locking in gains incrementally, rather than waiting for a single price peak, allows investors to reduce risk while still benefiting from future appreciation. This strategy can help mitigate potential losses in the event of a market correction and ensure that investors do not miss opportunities to realize returns during XRP’s rise. The current debate within the XRP community highlights two distinct schools of thought, one advocating for long-term patience and another promoting strategic exits. There is no certainty that XRP will reach $20, $100, or beyond by 2030. However, with multiple analysts projecting considerable upside, many investors are choosing to remain committed for the long haul. Disclaimer : This content is meant to inform and should not be considered financial advice. The views expressed in this article may include the author’s personal opinions and do not represent Times Tabloid’s opinion. Readers are urged to do in-depth research before making any investment decisions. Any action taken by the reader is strictly at their own risk. Times Tabloid is not responsible for any financial losses. Follow us on Twitter , Facebook , Telegram , and Google News The post Time Traveler Says Do Nothing With XRP Until 2030. Here’s why appeared first on Times Tabloid ."
2025-07-23 23:30:30+00:00,"SEC Grants, Then Halts, Approval for Crypto ETF With XRP: Expert Calls It ‘Bizarre Situation’","A high-profile crypto ETF holding bitcoin, ether, XRP, and more wins SEC approval, but a surprise stay halts its launch, leaving markets hanging in suspense. SEC Stay Delays Launch of Bitwise ETF Featuring Bitcoin, Ether, XRP, and More The U.S. Securities and Exchange Commission (SEC) approved a major multi-asset crypto exchange-traded fund (ETF) on July",bitcoin.com,https://news.bitcoin.com/sec-grants-then-halts-approval-for-crypto-etf-with-xrp-expert-calls-it-bizarre-situation/,REGULATION|XRP|BTC|EXCHANGE|MARKET,Regulation|Bitwise|Ripple XRP|SEC,BTC,"SEC Grants, Then Halts, Approval for Crypto ETF With XRP: Expert Calls It ‘Bizarre Situation’. A high-profile crypto ETF holding bitcoin, ether, XRP, and more wins SEC approval, but a surprise stay halts its launch, leaving markets hanging in suspense. SEC Stay Delays Launch of Bitwise ETF Featuring Bitcoin, Ether, XRP, and More The U.S. Securities and Exchange Commission (SEC) approved a major multi-asset crypto exchange-traded fund (ETF) on July"
2025-07-23 23:55:23+00:00,Imminent Federal Reserve Chair Nomination: What It Means for Crypto,"BitcoinWorld Imminent Federal Reserve Chair Nomination: What It Means for Crypto In the dynamic world of cryptocurrencies, every major economic announcement from traditional finance often sends ripples across digital asset markets. A recent statement by U.S. Treasury Secretary Scott Bessent has captured significant attention, hinting at an imminent decision that could profoundly influence the economic landscape and, by extension, your crypto portfolio. According to a report from PiQ on X, Secretary Bessent informed Fox News that a nomination for the next Federal Reserve chair is anticipated to be announced as early as December or January. This revelation marks a pivotal moment, as the leadership of the Federal Reserve holds immense sway over monetary policy, interest rates, and the overall economic climate – factors that are inextricably linked to the volatility and valuation of cryptocurrencies. Understanding the Role of the Federal Reserve Chair The Federal Reserve chair is arguably one of the most powerful economic figures globally. This individual leads the Federal Reserve System, the central banking system of the United States. Their primary responsibilities include: Setting Monetary Policy: Decisions on interest rates, quantitative easing (QE), and quantitative tightening (QT) directly impact the cost of borrowing, inflation, and liquidity in the financial system. Fostering Financial Stability: Overseeing the banking system and working to prevent financial crises. Promoting Maximum Employment and Stable Prices: These are the Fed’s dual mandate, guiding all policy decisions. For crypto enthusiasts, understanding these roles is crucial. When the Fed adopts a hawkish stance (e.g., raising interest rates), it typically strengthens the dollar and makes riskier assets, like cryptocurrencies, less attractive. Conversely, a dovish approach (e.g., lowering rates or QE) can inject liquidity, potentially boosting crypto valuations as investors seek higher returns. Why an Imminent Federal Reserve Chair Nomination Matters for Crypto The appointment of a new Federal Reserve chair isn’t just a bureaucratic change; it signals potential shifts in economic philosophy and policy direction. The crypto market, known for its sensitivity to macroeconomic trends, often reacts strongly to such developments. Here’s why this nomination is particularly significant: Policy Continuity vs. Change: Will the new chair maintain the current trajectory of monetary policy, or will they introduce a fresh approach? A shift towards a more dovish or hawkish stance could dramatically alter market dynamics. Inflation Expectations: The Fed’s stance on inflation control directly influences investor confidence. If the market perceives the new chair as more aggressive in combating inflation, it could lead to tighter monetary conditions, impacting crypto. Interest Rate Outlook: Higher interest rates increase the cost of capital, making borrowing more expensive for businesses and individuals. This can reduce speculative investment in assets like crypto. Conversely, lower rates can encourage risk-taking. Investor Sentiment: Uncertainty surrounding leadership changes can lead to market volatility. Crypto investors often look for clarity and stability, and a new chair brings a period of assessment. The market will be scrutinizing the nominee’s past statements, economic philosophy, and public perception to gauge their potential impact on future policy decisions. This anticipation alone can create significant price movements in digital assets. Navigating Potential Shifts: What a New Federal Reserve Chair Could Mean for Markets The identity and economic leanings of the next Federal Reserve chair will be paramount. Generally, nominees are categorized into two broad camps based on their monetary policy preferences: Hawkish Nominee A hawkish individual prioritizes controlling inflation, even if it means slower economic growth or higher unemployment. Their policy toolkit often includes: Aggressive interest rate hikes. Rapid quantitative tightening (reducing the Fed’s balance sheet). A strong dollar policy. Impact on Crypto: A hawkish Fed typically leads to a ‘risk-off’ environment. This means investors might pull funds from speculative assets like cryptocurrencies and move towards safer havens like U.S. Treasury bonds or cash. Higher interest rates also increase the opportunity cost of holding non-yielding assets like Bitcoin, potentially leading to downward price pressure. Dovish Nominee A dovish individual prioritizes economic growth and employment, often willing to tolerate higher inflation to achieve these goals. Their policy preferences might include: Lower interest rates or maintaining accommodative policies. Slower quantitative tightening or even quantitative easing. A weaker dollar policy. Impact on Crypto: A dovish Fed generally fosters a ‘risk-on’ environment. Abundant liquidity and lower interest rates can encourage investors to seek higher returns",bitcoinworld,https://bitcoinworld.co.in/fed-chair-nomination-crypto/,FIAT|MARKET|BUSINESS|REGULATION|BTC,Crypto News|Crypto Market|FED|Investment|monetary policy|US economy,BTC,"Imminent Federal Reserve Chair Nomination: What It Means for Crypto. BitcoinWorld Imminent Federal Reserve Chair Nomination: What It Means for Crypto In the dynamic world of cryptocurrencies, every major economic announcement from traditional finance often sends ripples across digital asset markets. A recent statement by U.S. Treasury Secretary Scott Bessent has captured significant attention, hinting at an imminent decision that could profoundly influence the economic landscape and, by extension, your crypto portfolio. According to a report from PiQ on X, Secretary Bessent informed Fox News that a nomination for the next Federal Reserve chair is anticipated to be announced as early as December or January. This revelation marks a pivotal moment, as the leadership of the Federal Reserve holds immense sway over monetary policy, interest rates, and the overall economic climate – factors that are inextricably linked to the volatility and valuation of cryptocurrencies. Understanding the Role of the Federal Reserve Chair The Federal Reserve chair is arguably one of the most powerful economic figures globally. This individual leads the Federal Reserve System, the central banking system of the United States. Their primary responsibilities include: Setting Monetary Policy: Decisions on interest rates, quantitative easing (QE), and quantitative tightening (QT) directly impact the cost of borrowing, inflation, and liquidity in the financial system. Fostering Financial Stability: Overseeing the banking system and working to prevent financial crises. Promoting Maximum Employment and Stable Prices: These are the Fed’s dual mandate, guiding all policy decisions. For crypto enthusiasts, understanding these roles is crucial. When the Fed adopts a hawkish stance (e.g., raising interest rates), it typically strengthens the dollar and makes riskier assets, like cryptocurrencies, less attractive. Conversely, a dovish approach (e.g., lowering rates or QE) can inject liquidity, potentially boosting crypto valuations as investors seek higher returns. Why an Imminent Federal Reserve Chair Nomination Matters for Crypto The appointment of a new Federal Reserve chair isn’t just a bureaucratic change; it signals potential shifts in economic philosophy and policy direction. The crypto market, known for its sensitivity to macroeconomic trends, often reacts strongly to such developments. Here’s why this nomination is particularly significant: Policy Continuity vs. Change: Will the new chair maintain the current trajectory of monetary policy, or will they introduce a fresh approach? A shift towards a more dovish or hawkish stance could dramatically alter market dynamics. Inflation Expectations: The Fed’s stance on inflation control directly influences investor confidence. If the market perceives the new chair as more aggressive in combating inflation, it could lead to tighter monetary conditions, impacting crypto. Interest Rate Outlook: Higher interest rates increase the cost of capital, making borrowing more expensive for businesses and individuals. This can reduce speculative investment in assets like crypto. Conversely, lower rates can encourage risk-taking. Investor Sentiment: Uncertainty surrounding leadership changes can lead to market volatility. Crypto investors often look for clarity and stability, and a new chair brings a period of assessment. The market will be scrutinizing the nominee’s past statements, economic philosophy, and public perception to gauge their potential impact on future policy decisions. This anticipation alone can create significant price movements in digital assets. Navigating Potential Shifts: What a New Federal Reserve Chair Could Mean for Markets The identity and economic leanings of the next Federal Reserve chair will be paramount. Generally, nominees are categorized into two broad camps based on their monetary policy preferences: Hawkish Nominee A hawkish individual prioritizes controlling inflation, even if it means slower economic growth or higher unemployment. Their policy toolkit often includes: Aggressive interest rate hikes. Rapid quantitative tightening (reducing the Fed’s balance sheet). A strong dollar policy. Impact on Crypto: A hawkish Fed typically leads to a ‘risk-off’ environment. This means investors might pull funds from speculative assets like cryptocurrencies and move towards safer havens like U.S. Treasury bonds or cash. Higher interest rates also increase the opportunity cost of holding non-yielding assets like Bitcoin, potentially leading to downward price pressure. Dovish Nominee A dovish individual prioritizes economic growth and employment, often willing to tolerate higher inflation to achieve these goals. Their policy preferences might include: Lower interest rates or maintaining accommodative policies. Slower quantitative tightening or even quantitative easing. A weaker dollar policy. Impact on Crypto: A dovish Fed generally fosters a ‘risk-on’ environment. Abundant liquidity and lower interest rates can encourage investors to seek higher returns"
2025-07-24 00:01:00+00:00,"Is XRP Stronger Than Ethereum? Bitcoin''s (BTC) $150,000 is Around Corner, Shiba Inu (SHIB): Summer''s Biggest Test Incoming","Market recovery might come sooner than expected, following relatively calm correction period",utoday,https://u.today/is-xrp-stronger-than-ethereum-bitcoins-btc-150000-around-corner-shiba-inu-shib-summers-biggest-test,BTC|SHIB|ETH|XRP|MARKET,Shiba Inu,BTC,"Is XRP Stronger Than Ethereum? Bitcoin''s (BTC) $150,000 is Around Corner, Shiba Inu (SHIB): Summer''s Biggest Test Incoming. Market recovery might come sooner than expected, following relatively calm correction period"
2025-07-24 00:07:58+00:00,FTX Announces August 2025 Registration for Next Distribution to Bitcoin Claim Holders,"🚀 Are You Chasing New Coins? Catch the newest crypto opportunities. Be the first to buy, be the first to win! Click here to discover new altcoins! On July 24,",coinotag,https://en.coinotag.com/breakingnews/ftx-announces-august-2025-registration-for-next-distribution-to-bitcoin-claim-holders/,BTC|FTT|ALTCOIN,BTC|FTT,BTC,"FTX Announces August 2025 Registration for Next Distribution to Bitcoin Claim Holders. 🚀 Are You Chasing New Coins? Catch the newest crypto opportunities. Be the first to buy, be the first to win! Click here to discover new altcoins! On July 24,"
2025-07-24 00:10:14+00:00,"Bitcoin Nears $150,000 Potential as Shiba Inu Faces Critical Support Test","🚀 Are You Chasing New Coins? Catch the newest crypto opportunities. Be the first to buy, be the first to win! Click here to discover new altcoins! XRP’s recent surge",coinotag,https://en.coinotag.com/bitcoin-nears-150000-potential-as-shiba-inu-faces-critical-support-test/,BTC|SHIB|XRP|ETH|FLOW,Analysis|News|AUCTION|BTC|ETH|FLOW|SHIB|XRP,BTC,"Bitcoin Nears $150,000 Potential as Shiba Inu Faces Critical Support Test. 🚀 Are You Chasing New Coins? Catch the newest crypto opportunities. Be the first to buy, be the first to win! Click here to discover new altcoins! XRP’s recent surge"
2025-07-24 00:16:52+00:00,SEC Places Bitwise Bitcoin-Heavy Crypto ETF Approval Under Review Amid Regulatory Uncertainty,"🚀 Are You Chasing New Coins? Catch the newest crypto opportunities. Be the first to buy, be the first to win! Click here to discover new altcoins! The SEC has",coinotag,https://en.coinotag.com/sec-places-bitwise-bitcoin-heavy-crypto-etf-approval-under-review-amid-regulatory-uncertainty/,REGULATION|ADA|BTC|ETH|SOL,News|ADA|BTC|ETH|SOL|XRP,BTC,"SEC Places Bitwise Bitcoin-Heavy Crypto ETF Approval Under Review Amid Regulatory Uncertainty. 🚀 Are You Chasing New Coins? Catch the newest crypto opportunities. Be the first to buy, be the first to win! Click here to discover new altcoins! The SEC has"
