DATETIME,HEADLINE,SUMMARY,SOURCE,URL,CATEGORIES,TAGS,asset,text
2025-07-23 16:44:55+00:00,MARA Bets Big on Bitcoin Again with $850 Million Debt Raise,"MARA Holdings is going all in. The publicly traded Bitcoin miner already holds over 50,000 BTC. Now, it’s adding more firepower. On Wednesday, MARA priced an $850 million private offering of zero-coupon, senior unsecured convertible notes due 2032. The deal is limited to qualified institutional buyers, who also get a 13-day option to purchase an additional $150 million in notes. The move gives MARA financial agility. First, it will retire $50 million of its existing 1% convertible senior notes due 2026. Then, it plans to deploy the bulk of proceeds toward capped-call hedges, fresh Bitcoin purchases, and general corporate purposes. The notes structure is smart and strategic. Since they’re zero-coupon, MARA avoids interest payments altogether. Investors can convert the notes into equity if MARA’s stock crosses a certain price threshold. If not, the company simply repays the principal in 2032—minimizing dilution and conserving cash in the interim. Shares of MARA currently trade near $18.21 on NASDAQ, giving the company a market cap around $6.35 billion , according to TradingView and CompaniesMarketCap . That valuation places MARA among the most valuable Bitcoin mining companies globally—both in market size and on-chain Bitcoin reserves. Meanwhile, Bitcoin itself is roaring, recently trading above $118,600 per coin. Demand continues to run hot. Miners like MARA feed the rally—selling some BTC to fund operations, while tucking away the rest as long-term treasury assets. MARA CEO Fred Thiel has made the company’s strategy clear: play the long game. He’s said repeatedly that MARA won’t sell into weakness. Instead, it aims to become a digital asset treasury powerhouse. Critics, however, are wary. Some question the timing and growing debt load. They see the math: more BTC on the asset side, more notes on the liabilities. It’s a high-conviction bet—and not without risk. Still, institutional buyers seem intrigued. The structure offers them upside via potential equity conversion at a discount, while backing a miner with serious on-chain weight. MARA Holdings To Run On Two Strategies That $150 million add-on option gives MARA flexibility. If demand holds, it could push total proceeds to $1 billion . That could be tapped quickly—especially if market conditions remain favorable. Reaction across crypto Twitter was swift. Industry voices like WuBlockchain hailed the move , while analyst Marty Chargin offered deeper color. MARA’s strategy now runs on two engines: securing ultra-cheap capital and hoarding Bitcoin . This notes offering checks both boxes. Eyes are now on the 13-day window. Traders will watch for BTC price swings. They’ll monitor MARA’s share price. The question looms: will investors convert—or will MARA repay? $MARA … MARA Holdings (MARA) said Wednesday it has launched a private offering of $850 million in 0% convertible senior unsecured notes due 2032 to qualified institutional buyers. Initial purchasers have been granted a 13-day option to buy up to an additional $150 million in… pic.twitter.com/2fOvemjYhX — Marty Chargin (@MartyChargin) July 23, 2025 Behind the headlines, MARA’s mining rigs continue humming. The company’s hashrate keeps rising, energy deals lock in long-term capacity, and operational efficiencies improve. In Q2 2025 , MARA mined nearly 9,000 BTC , growing its already-massive treasury. This $850 million raise is MARA’s largest financing deal to date. It’s a bold statement and a bet on Bitcoin’s long-term trajectory. MARA is no longer just a miner. It’s a Bitcoin accumulator, a treasury strategist, and increasingly, a market mover. The crypto industry is watching. Wall Street is watching. And MARA is moving fast, building its Bitcoin mountain, one convertible note at a time. Disclosure: This is not trading or investment advice. Always do your research before buying any cryptocurrency or investing in any services. Follow us on Twitter @nulltxnews to stay updated with the latest Crypto, NFT, AI, Cybersecurity, Distributed Computing, and Metaverse news !",themerkle,https://nulltx.com/mara-bets-big-on-bitcoin-again-with-850-million-debt-raise/,BTC|TRADING|MARKET|REGULATION|TREASURY,Crypto|News,BTC,"MARA Bets Big on Bitcoin Again with $850 Million Debt Raise. MARA Holdings is going all in. The publicly traded Bitcoin miner already holds over 50,000 BTC. Now, it’s adding more firepower. On Wednesday, MARA priced an $850 million private offering of zero-coupon, senior unsecured convertible notes due 2032. The deal is limited to qualified institutional buyers, who also get a 13-day option to purchase an additional $150 million in notes. The move gives MARA financial agility. First, it will retire $50 million of its existing 1% convertible senior notes due 2026. Then, it plans to deploy the bulk of proceeds toward capped-call hedges, fresh Bitcoin purchases, and general corporate purposes. The notes structure is smart and strategic. Since they’re zero-coupon, MARA avoids interest payments altogether. Investors can convert the notes into equity if MARA’s stock crosses a certain price threshold. If not, the company simply repays the principal in 2032—minimizing dilution and conserving cash in the interim. Shares of MARA currently trade near $18.21 on NASDAQ, giving the company a market cap around $6.35 billion , according to TradingView and CompaniesMarketCap . That valuation places MARA among the most valuable Bitcoin mining companies globally—both in market size and on-chain Bitcoin reserves. Meanwhile, Bitcoin itself is roaring, recently trading above $118,600 per coin. Demand continues to run hot. Miners like MARA feed the rally—selling some BTC to fund operations, while tucking away the rest as long-term treasury assets. MARA CEO Fred Thiel has made the company’s strategy clear: play the long game. He’s said repeatedly that MARA won’t sell into weakness. Instead, it aims to become a digital asset treasury powerhouse. Critics, however, are wary. Some question the timing and growing debt load. They see the math: more BTC on the asset side, more notes on the liabilities. It’s a high-conviction bet—and not without risk. Still, institutional buyers seem intrigued. The structure offers them upside via potential equity conversion at a discount, while backing a miner with serious on-chain weight. MARA Holdings To Run On Two Strategies That $150 million add-on option gives MARA flexibility. If demand holds, it could push total proceeds to $1 billion . That could be tapped quickly—especially if market conditions remain favorable. Reaction across crypto Twitter was swift. Industry voices like WuBlockchain hailed the move , while analyst Marty Chargin offered deeper color. MARA’s strategy now runs on two engines: securing ultra-cheap capital and hoarding Bitcoin . This notes offering checks both boxes. Eyes are now on the 13-day window. Traders will watch for BTC price swings. They’ll monitor MARA’s share price. The question looms: will investors convert—or will MARA repay? $MARA … MARA Holdings (MARA) said Wednesday it has launched a private offering of $850 million in 0% convertible senior unsecured notes due 2032 to qualified institutional buyers. Initial purchasers have been granted a 13-day option to buy up to an additional $150 million in… pic.twitter.com/2fOvemjYhX — Marty Chargin (@MartyChargin) July 23, 2025 Behind the headlines, MARA’s mining rigs continue humming. The company’s hashrate keeps rising, energy deals lock in long-term capacity, and operational efficiencies improve. In Q2 2025 , MARA mined nearly 9,000 BTC , growing its already-massive treasury. This $850 million raise is MARA’s largest financing deal to date. It’s a bold statement and a bet on Bitcoin’s long-term trajectory. MARA is no longer just a miner. It’s a Bitcoin accumulator, a treasury strategist, and increasingly, a market mover. The crypto industry is watching. Wall Street is watching. And MARA is moving fast, building its Bitcoin mountain, one convertible note at a time. Disclosure: This is not trading or investment advice. Always do your research before buying any cryptocurrency or investing in any services. Follow us on Twitter @nulltxnews to stay updated with the latest Crypto, NFT, AI, Cybersecurity, Distributed Computing, and Metaverse news !"
2025-07-23 16:52:05+00:00,"DDC Founder Aims to Hold 10,000 BTC by 2025 and Rank Among Top Three Global Bitcoin Reserve Companies","🚀 Are You Chasing New Coins? Catch the newest crypto opportunities. Be the first to buy, be the first to win! Click here to discover new altcoins! DDC’s founder, leading",coinotag,https://en.coinotag.com/breakingnews/ddc-founder-aims-to-hold-10000-btc-by-2025-and-rank-among-top-three-global-bitcoin-reserve-companies/,BTC|FIAT|ALTCOIN,BTC,BTC,"DDC Founder Aims to Hold 10,000 BTC by 2025 and Rank Among Top Three Global Bitcoin Reserve Companies. 🚀 Are You Chasing New Coins? Catch the newest crypto opportunities. Be the first to buy, be the first to win! Click here to discover new altcoins! DDC’s founder, leading"
2025-07-23 16:54:00+00:00,"Block Inc. Joins S&P 500, Potentially Enhancing Institutional Exposure to Bitcoin","🚀 Are You Chasing New Coins? Catch the newest crypto opportunities. Be the first to buy, be the first to win! Click here to discover new altcoins! Block Inc.’s recent",coinotag,https://en.coinotag.com/block-inc-joins-sp-500-potentially-enhancing-institutional-exposure-to-bitcoin/,BTC|ALTCOIN,News|BTC,BTC,"Block Inc. Joins S&P 500, Potentially Enhancing Institutional Exposure to Bitcoin. 🚀 Are You Chasing New Coins? Catch the newest crypto opportunities. Be the first to buy, be the first to win! Click here to discover new altcoins! Block Inc.’s recent"
2025-07-23 16:55:18+00:00,"Here’s Why ETH Lagged Behind for Years, According to Ethereum Co-Founder Joseph Lubin","Ethereum co-founder Joseph Lubin says the project’s development focus could have been behind the lag in ETH ‘s price. In a new interview with Milk Road , Lubin, the chair of SharpLink, a gaming company with an Ethereum treasury, notes that the ecosystem is focused on block space. “The way the technology is built, it’s built out in the open with a lot of people bickering about a lot of great ideas and prioritizing them, and so that may look like there’s discord in the Ethereum ecosystem, or it just looks like we’re building and scrutinizing lots of different potential paths forward, so pretty healthy in general. When it gets to feel negative, is when price leads sentiment, so if for some reason, the price is lagging, if it’s lagging for a couple of years or three years, against big brother Bitcoin or little brother Solana, then people start to get stressed and they start pointing fingers. So as I said before, we didn’t have as many applications as we would’ve liked to have, we didn’t have as many users as we would’ve liked to have. We had has much block space as we wanted because that was our goal, to build as much capacity as we could as fast as we could because we want to move the web onto Web3 and we want to move the entire global economy onto sounder, decentralized rails, so that they can take advantage of the much greater trust properties of Ethereum and decentralized trust in general.” Lubin explains that the “glut” of block space and ETH led to a lack of demand. ETH accumulators are now focused on trying to “tighten up” the asset’s supply/demand dynamics, the Sharplink chair explains. ? Follow us on X , Facebook and Telegram Don''t Miss a Beat – Subscribe to get email alerts delivered directly to your inbox Check Price Action Surf The Daily Hodl Mix Disclaimer: Opinions expressed at The Daily Hodl are not investment advice. Investors should do their due diligence before making any high-risk investments in Bitcoin, cryptocurrency or digital assets. Please be advised that your transfers and trades are at your own risk, and any losses you may incur are your responsibility. The Daily Hodl does not recommend the buying or selling of any cryptocurrencies or digital assets, nor is The Daily Hodl an investment advisor. Please note that The Daily Hodl participates in affiliate marketing. Generated Image: Midjourney The post Here’s Why ETH Lagged Behind for Years, According to Ethereum Co-Founder Joseph Lubin appeared first on The Daily Hodl .",dailyhodl,https://dailyhodl.com/2025/07/23/heres-why-eth-lagged-behind-for-years-according-to-ethereum-co-founder-joseph-lubin/,ETH|TRADING|BTC|BUSINESS|REGULATION,Ethereum|ETH|joseph lubin|News|SharpLink,BTC,"Here’s Why ETH Lagged Behind for Years, According to Ethereum Co-Founder Joseph Lubin. Ethereum co-founder Joseph Lubin says the project’s development focus could have been behind the lag in ETH ‘s price. In a new interview with Milk Road , Lubin, the chair of SharpLink, a gaming company with an Ethereum treasury, notes that the ecosystem is focused on block space. “The way the technology is built, it’s built out in the open with a lot of people bickering about a lot of great ideas and prioritizing them, and so that may look like there’s discord in the Ethereum ecosystem, or it just looks like we’re building and scrutinizing lots of different potential paths forward, so pretty healthy in general. When it gets to feel negative, is when price leads sentiment, so if for some reason, the price is lagging, if it’s lagging for a couple of years or three years, against big brother Bitcoin or little brother Solana, then people start to get stressed and they start pointing fingers. So as I said before, we didn’t have as many applications as we would’ve liked to have, we didn’t have as many users as we would’ve liked to have. We had has much block space as we wanted because that was our goal, to build as much capacity as we could as fast as we could because we want to move the web onto Web3 and we want to move the entire global economy onto sounder, decentralized rails, so that they can take advantage of the much greater trust properties of Ethereum and decentralized trust in general.” Lubin explains that the “glut” of block space and ETH led to a lack of demand. ETH accumulators are now focused on trying to “tighten up” the asset’s supply/demand dynamics, the Sharplink chair explains. ? Follow us on X , Facebook and Telegram Don''t Miss a Beat – Subscribe to get email alerts delivered directly to your inbox Check Price Action Surf The Daily Hodl Mix Disclaimer: Opinions expressed at The Daily Hodl are not investment advice. Investors should do their due diligence before making any high-risk investments in Bitcoin, cryptocurrency or digital assets. Please be advised that your transfers and trades are at your own risk, and any losses you may incur are your responsibility. The Daily Hodl does not recommend the buying or selling of any cryptocurrencies or digital assets, nor is The Daily Hodl an investment advisor. Please note that The Daily Hodl participates in affiliate marketing. Generated Image: Midjourney The post Here’s Why ETH Lagged Behind for Years, According to Ethereum Co-Founder Joseph Lubin appeared first on The Daily Hodl ."
2025-07-23 16:59:49+00:00,"ETH news update: Can SharpLink Gaming, BitMine treasuries send Ether to $4K?","Ether price pulled back after a relentless run, but lower levels are likely to attract buyers.",Cointelegraph,https://cointelegraph.com/news/eth-news-update-can-sharplink-gaming-bitmine-treasuries-send-ether-to-dollar4k?utm_source=rss_feed&utm_medium=rss&utm_campaign=rss_partner_inbound,,,BTC,"ETH news update: Can SharpLink Gaming, BitMine treasuries send Ether to $4K?. Ether price pulled back after a relentless run, but lower levels are likely to attract buyers."
2025-07-23 17:02:14+00:00,Jim Cramer Plans to Own Bitcoin and Ethereum as Hedge for His Kids,The post Jim Cramer Plans to Own Bitcoin and Ethereum as Hedge for His Kids appeared first on Coinpedia Fintech News Jim Cramer revealed he intends to “own” Bitcoin and Ethereum to protect his children’s financial future. He views these cryptocurrencies as a hedge against the growing U.S. national debt and potential dollar depreciation. Cramer emphasized the importance of digital assets in diversifying traditional investments amid economic uncertainties. His stance highlights increasing mainstream acceptance of Bitcoin and ETH as long-term stores of value in turbulent financial times.,coinpedia,https://coinpedia.org/crypto-live-news/jim-cramer-plans-to-own-bitcoin-and-ethereum-as-hedge-for-his-kids/,BTC|ETH,Short News|Crypto news,BTC,Jim Cramer Plans to Own Bitcoin and Ethereum as Hedge for His Kids. The post Jim Cramer Plans to Own Bitcoin and Ethereum as Hedge for His Kids appeared first on Coinpedia Fintech News Jim Cramer revealed he intends to “own” Bitcoin and Ethereum to protect his children’s financial future. He views these cryptocurrencies as a hedge against the growing U.S. national debt and potential dollar depreciation. Cramer emphasized the importance of digital assets in diversifying traditional investments amid economic uncertainties. His stance highlights increasing mainstream acceptance of Bitcoin and ETH as long-term stores of value in turbulent financial times.
2025-07-23 17:06:01+00:00,"Ethereum Spot Volume Surpasses Bitcoin’s, Indicating Possible Shift in Crypto Market Dynamics","🚀 Are You Chasing New Coins? Catch the newest crypto opportunities. Be the first to buy, be the first to win! Click here to discover new altcoins! Ethereum’s spot trading",coinotag,https://en.coinotag.com/ethereum-spot-volume-surpasses-bitcoins-indicating-possible-shift-in-crypto-market-dynamics/,ETH|BTC|MARKET|ARB|ALTCOIN,Bitcoin|Ethereum|News|ARB|BTC|ETH,BTC,"Ethereum Spot Volume Surpasses Bitcoin’s, Indicating Possible Shift in Crypto Market Dynamics. 🚀 Are You Chasing New Coins? Catch the newest crypto opportunities. Be the first to buy, be the first to win! Click here to discover new altcoins! Ethereum’s spot trading"
