DATETIME,HEADLINE,SUMMARY,SOURCE,URL,CATEGORIES,TAGS,asset,text
2025-07-24 10:41:57+00:00,Bitcoin Dominance Spikes as Altcoin Season Index Crashes – Is a Sell-off Coming?,"The post Bitcoin Dominance Spikes as Altcoin Season Index Crashes – Is a Sell-off Coming? appeared first on Coinpedia Fintech News The cryptocurrency market is experiencing a shift in trend. In the wake of sharp capital flows and rapid changes in investor sentiment, Bitcoin is once again asserting its supremacy. The total crypto market cap has dipped to $3.82 trillion, a decline of 2.75%, even as 24-hour trading volumes soared to $222 billion. Meanwhile, Bitcoin’s dominance has climbed to 61.52% and Ethereum holds 11.3%. Further highlighting that the ongoing retreat from altcoins, as the Altcoin Season Index drops to just 34/100. With the Fear & Greed Index flashing greed at 67, the market stands at a crossroads between opportunity and caution. If you are one of the curious minds who are keen on what the future might hold, this analysis is for you. Bitcoin Takes Center Stage as Capital Rotates Again? Recent data shows a reversion to “Bitcoin season,” marked by robust inflows into BTC. Investors, fearing uncertain macro catalysts, are reallocating from riskier altcoins into the perceived safety of Bitcoin. This shift is underlined by the dominance metric surpassing 61%, levels not seen since past cycles of heightened caution or anticipation for major Bitcoin-specific catalysts. Source: CoinMarketCap At the same time, the market’s total value has slipped, indicating possible profit-taking, or de-risking. However, the 13.26% surge in trading volume hints at hectic repositioning. Altcoin Season on Pause? The Altcoin Season Index at only 34/100 signals that fewer top altcoins are outperforming Bitcoin. Historically, this metric suggests traders are consolidating holdings into BTC, either due to regulatory nerves, lack of major altcoin narratives, or simply to avoid risks. Source: CoinMarketCap Supporting this, on-chain activity points to increased Bitcoin holding durations, which we call “diamond hands”. Where we see thickening order books and consistent net outflows of BTC from exchanges. Each is contributing to supportive price action for Bitcoin while altcoins lag. Successively, the Fear & Greed Index at 67 reflects ongoing appetite for risk, but in the context of falling altcoin performance. Much of this “greed” may be directed at Bitcoin rather than speculative plays. The narrative is rich in FOMO, but also conscious of downside risk in less liquid assets. The Road Ahead: What to Watch Regulatory clarity or ETF-led institutional flows could further enhance Bitcoin’s leadership. ETH’s relative underperformance with an 11.3% dominance may persist if scaling debates and L2 solutions fail to reignite excitement. Renewed risk appetite could bring swift altcoin rebounds, but for now, discipline favors established assets. FAQs Why is Bitcoin dominance rising right now? Investors are moving funds into Bitcoin as a safer play amid recent market volatility and macro uncertainties. With the Altcoin Season Index at 34, is the bull run for altcoins lost? The market is currently favoring BTC over altcoins, possibly to avoid risks. We can expect the trend to renew once the sentiments stabilize.",coinpedia,https://coinpedia.org/news/bitcoin-dominance-spikes-as-altcoin-season-index-crashes-is-a-sell-off-coming/,BTC|ALTCOIN|MARKET|TRADING|BUSINESS,News|Crypto news,BTC,"Bitcoin Dominance Spikes as Altcoin Season Index Crashes – Is a Sell-off Coming?. The post Bitcoin Dominance Spikes as Altcoin Season Index Crashes – Is a Sell-off Coming? appeared first on Coinpedia Fintech News The cryptocurrency market is experiencing a shift in trend. In the wake of sharp capital flows and rapid changes in investor sentiment, Bitcoin is once again asserting its supremacy. The total crypto market cap has dipped to $3.82 trillion, a decline of 2.75%, even as 24-hour trading volumes soared to $222 billion. Meanwhile, Bitcoin’s dominance has climbed to 61.52% and Ethereum holds 11.3%. Further highlighting that the ongoing retreat from altcoins, as the Altcoin Season Index drops to just 34/100. With the Fear & Greed Index flashing greed at 67, the market stands at a crossroads between opportunity and caution. If you are one of the curious minds who are keen on what the future might hold, this analysis is for you. Bitcoin Takes Center Stage as Capital Rotates Again? Recent data shows a reversion to “Bitcoin season,” marked by robust inflows into BTC. Investors, fearing uncertain macro catalysts, are reallocating from riskier altcoins into the perceived safety of Bitcoin. This shift is underlined by the dominance metric surpassing 61%, levels not seen since past cycles of heightened caution or anticipation for major Bitcoin-specific catalysts. Source: CoinMarketCap At the same time, the market’s total value has slipped, indicating possible profit-taking, or de-risking. However, the 13.26% surge in trading volume hints at hectic repositioning. Altcoin Season on Pause? The Altcoin Season Index at only 34/100 signals that fewer top altcoins are outperforming Bitcoin. Historically, this metric suggests traders are consolidating holdings into BTC, either due to regulatory nerves, lack of major altcoin narratives, or simply to avoid risks. Source: CoinMarketCap Supporting this, on-chain activity points to increased Bitcoin holding durations, which we call “diamond hands”. Where we see thickening order books and consistent net outflows of BTC from exchanges. Each is contributing to supportive price action for Bitcoin while altcoins lag. Successively, the Fear & Greed Index at 67 reflects ongoing appetite for risk, but in the context of falling altcoin performance. Much of this “greed” may be directed at Bitcoin rather than speculative plays. The narrative is rich in FOMO, but also conscious of downside risk in less liquid assets. The Road Ahead: What to Watch Regulatory clarity or ETF-led institutional flows could further enhance Bitcoin’s leadership. ETH’s relative underperformance with an 11.3% dominance may persist if scaling debates and L2 solutions fail to reignite excitement. Renewed risk appetite could bring swift altcoin rebounds, but for now, discipline favors established assets. FAQs Why is Bitcoin dominance rising right now? Investors are moving funds into Bitcoin as a safer play amid recent market volatility and macro uncertainties. With the Altcoin Season Index at 34, is the bull run for altcoins lost? The market is currently favoring BTC over altcoins, possibly to avoid risks. We can expect the trend to renew once the sentiments stabilize."
2025-07-24 10:48:29+00:00,"Bitcoin Drops Below $118,000 on July 24 with a 0.16% 24-Hour Decline","🚀 Are You Chasing New Coins? Catch the newest crypto opportunities. Be the first to buy, be the first to win! Click here to discover new altcoins! On July 24,",coinotag,https://en.coinotag.com/breakingnews/bitcoin-drops-below-118000-on-july-24-with-a-0-16-24-hour-decline/,BTC|ALTCOIN,BTC,BTC,"Bitcoin Drops Below $118,000 on July 24 with a 0.16% 24-Hour Decline. 🚀 Are You Chasing New Coins? Catch the newest crypto opportunities. Be the first to buy, be the first to win! Click here to discover new altcoins! On July 24,"
2025-07-24 10:52:01+00:00,Japanese Companies Like Quantum Solutions May Expand Bitcoin Holdings Amid Corporate Treasury Trends,"🚀 Are You Chasing New Coins? Catch the newest crypto opportunities. Be the first to buy, be the first to win! Click here to discover new altcoins! Quantum Solutions’ strategic",coinotag,https://en.coinotag.com/japanese-companies-like-quantum-solutions-may-expand-bitcoin-holdings-amid-corporate-treasury-trends/,BTC|REGULATION|ALTCOIN,Bitcoin|News|BTC,BTC,"Japanese Companies Like Quantum Solutions May Expand Bitcoin Holdings Amid Corporate Treasury Trends. 🚀 Are You Chasing New Coins? Catch the newest crypto opportunities. Be the first to buy, be the first to win! Click here to discover new altcoins! Quantum Solutions’ strategic"
2025-07-24 10:54:00+00:00,"Quantum Solutions May Build 3,000-Bitcoin Reserve Amid Yen Volatility and Treasury Strategy Shift","🚀 Are You Chasing New Coins? Catch the newest crypto opportunities. Be the first to buy, be the first to win! Click here to discover new altcoins! Quantum Solutions has",coinotag,https://en.coinotag.com/quantum-solutions-may-build-3000-bitcoin-reserve-amid-yen-volatility-and-treasury-strategy-shift/,FIAT|BTC|REGULATION|ALTCOIN,Bitcoin|News|BTC|Core,BTC,"Quantum Solutions May Build 3,000-Bitcoin Reserve Amid Yen Volatility and Treasury Strategy Shift. 🚀 Are You Chasing New Coins? Catch the newest crypto opportunities. Be the first to buy, be the first to win! Click here to discover new altcoins! Quantum Solutions has"
2025-07-24 11:01:08+00:00,"Crypto wrap: BTC steady but PUMP, Flare, and Aptos among big altcoin losers","The cryptocurrency market remains largely bullish, but traders are reeling from a sharp downturn seen during the Asian hours on July 24. As most altcoins flipped negative on the 24 hour timeframe, the global market capitalization fell 1.5% to $3.89 trillion, according to CoinMarketCap data. Meanwhile, global trading volume over the past 24 hours reached $225 billion, up 20% amid heightened activity. But as most analysts note, the volatile conditions aside, market sentiment leans bullish. In the short term, attention is on the significant altcoin declines. PUMP, Flare, and Aptos rank among biggest losers today, even as Bitcoin shows resilience. Over $960 million liquidated as altcoins fall Crypto market’s sharp decline has come amid more than $960 million in liquidations in the past 24 hours. According to Coinglass data , total liquidations jumped more than 260% in the past 24 hours, the majority of those wiped out being long positions. Data shows $828 million in bullish bets wiped out in the past day, a lot of this coming on the back of traders being caught off-guard by sharp altcoin declines. Per Coinglass, leveraged positions with Ethereum (ETH), Solana (SOL) and XRP contributed significantly to the liquidated longs tally. Bitcoin saw $81 million in leveraged positions rekt. The downturn appears driven by profit-taking following recent market highs, as well as macroeconomic uncertainties. Bitcoin steady as BTC price rebounds to $118k While Bitcoin (BTC) has failed to keep bears off following its run to a new all-time high, the bellwether crypto continues to demonstrate stability. Bulls have rebounded to highs of $118,377 after a brief stall below $117k. As altcoins shed some gains, this resilience has Bitcoin’s dominance back above 61%. Ethereum dominance is at 11%. Bitcoin’s price has hovered around $117,000–$118,000 this week, supported by robust capital flows and institutional demand. Notably, on-chain metrics indicate traders are showing some cautious optimism. Yet, with reduced profit-taking and steady accumulation by large holders, the overall take is that the leg up isn’t done. PUMP, Flare, and Aptos top losers in 24 hours Among the hardest-hit altcoins, PUMP, Flare, and Aptos led the losses over the past 24 hours. PUMP, a meme-driven token, plummeted by 18% to $0.003. Glassnode analysts say investors might want to cautious amid potential froth. glassnode @glassnode · Follow Altcoins are showing broad strength following #Bitcoin ’s lead, but surging open interest across the sector suggests speculative froth may be building, raising the risk of sharper volatility ahead.Discover more in the latest Week On-Chain below👇 glassno.de/4o927B4 3:40 pm · 23 Jul 2025 281 Reply Copy link Read 26 replies Elsewhere , Flare (FLR) gave up recent gains as price dropped more than 16% to $0.022. The FLR token jumped early in the week amid key network metrics. The Aptos (APT) token, native to the high-throughput blockchain platform for decentralized finance, was down 15% to $4.65. Like the other altcoins, Aptos’ price was down amid profit-taking. The post Crypto wrap: BTC steady but PUMP, Flare, and Aptos among big altcoin losers appeared first on Invezz",invezz,https://invezz.com/news/2025/07/24/crypto-wrap-btc-steady-but-pump-flare-and-aptos-among-big-altcoin-losers/,BTC|ALTCOIN|APT|TRADING|MARKET,Altcoins|Crypto|Bitcoin|Flare,BTC,"Crypto wrap: BTC steady but PUMP, Flare, and Aptos among big altcoin losers. The cryptocurrency market remains largely bullish, but traders are reeling from a sharp downturn seen during the Asian hours on July 24. As most altcoins flipped negative on the 24 hour timeframe, the global market capitalization fell 1.5% to $3.89 trillion, according to CoinMarketCap data. Meanwhile, global trading volume over the past 24 hours reached $225 billion, up 20% amid heightened activity. But as most analysts note, the volatile conditions aside, market sentiment leans bullish. In the short term, attention is on the significant altcoin declines. PUMP, Flare, and Aptos rank among biggest losers today, even as Bitcoin shows resilience. Over $960 million liquidated as altcoins fall Crypto market’s sharp decline has come amid more than $960 million in liquidations in the past 24 hours. According to Coinglass data , total liquidations jumped more than 260% in the past 24 hours, the majority of those wiped out being long positions. Data shows $828 million in bullish bets wiped out in the past day, a lot of this coming on the back of traders being caught off-guard by sharp altcoin declines. Per Coinglass, leveraged positions with Ethereum (ETH), Solana (SOL) and XRP contributed significantly to the liquidated longs tally. Bitcoin saw $81 million in leveraged positions rekt. The downturn appears driven by profit-taking following recent market highs, as well as macroeconomic uncertainties. Bitcoin steady as BTC price rebounds to $118k While Bitcoin (BTC) has failed to keep bears off following its run to a new all-time high, the bellwether crypto continues to demonstrate stability. Bulls have rebounded to highs of $118,377 after a brief stall below $117k. As altcoins shed some gains, this resilience has Bitcoin’s dominance back above 61%. Ethereum dominance is at 11%. Bitcoin’s price has hovered around $117,000–$118,000 this week, supported by robust capital flows and institutional demand. Notably, on-chain metrics indicate traders are showing some cautious optimism. Yet, with reduced profit-taking and steady accumulation by large holders, the overall take is that the leg up isn’t done. PUMP, Flare, and Aptos top losers in 24 hours Among the hardest-hit altcoins, PUMP, Flare, and Aptos led the losses over the past 24 hours. PUMP, a meme-driven token, plummeted by 18% to $0.003. Glassnode analysts say investors might want to cautious amid potential froth. glassnode @glassnode · Follow Altcoins are showing broad strength following #Bitcoin ’s lead, but surging open interest across the sector suggests speculative froth may be building, raising the risk of sharper volatility ahead.Discover more in the latest Week On-Chain below👇 glassno.de/4o927B4 3:40 pm · 23 Jul 2025 281 Reply Copy link Read 26 replies Elsewhere , Flare (FLR) gave up recent gains as price dropped more than 16% to $0.022. The FLR token jumped early in the week amid key network metrics. The Aptos (APT) token, native to the high-throughput blockchain platform for decentralized finance, was down 15% to $4.65. Like the other altcoins, Aptos’ price was down amid profit-taking. The post Crypto wrap: BTC steady but PUMP, Flare, and Aptos among big altcoin losers appeared first on Invezz"
