DATETIME,HEADLINE,SUMMARY,SOURCE,URL,CATEGORIES,TAGS,asset,text
2025-07-24 12:14:46+00:00,Poland admits one in five of Poles have invested in crypto during Bitcoin bill debate,"Some 18% of Polish citizens have already put money into crypto assets, according to Warsaw’s own estimates made public during a parliamentary debate on Poland’s upcoming cryptocurrency regulations. Members of the Sejm, the lower house of parliament in Poland, are considering a government-sponsored piece of legislation meant to regulate cryptocurrencies like Bitcoin in the country and the economy built around the digital assets. Bill No. 1424 was filed on June 26 and submitted for first reading in the chamber on July 7, the Polish crypto news outlet Bitcoin.pl reported Wednesday. On July 22, deputies launched the long-awaited debate on the proposed regulations, joined by representatives of the executive power in Warsaw. Fifth of Poles already invested in cryptocurrencies, government says Addressing lawmakers from the ruling majority and the opposition, Deputy Finance Minister Jurand Drop defended the cabinet’s motion, stressing that the Central European nation is yet to adopt rules providing protection for crypto investors. “20% of investors in this market declare that they have fallen victim to some kind of fraud or abuse,” the government official pointed out, while also emphasizing: “In Poland, 18% of people already have experience investing in crypto assets. These regulations are crucial for strengthening investor and customer protection in the crypto asset market.” Polish crypto sector fears bill may spark exodus of businesses The new legislation, aimed at transposing the European Union’s Markets in Crypto Assets ( MiCA ) regulation into national law, has been the cause of deep concerns among the members of the local crypto community. A worrying move for them is the decision to entrust oversight to the Polish Financial Supervision Authority ( KNF ), “which is notorious for its less-than-favorable attitude toward cryptocurrencies,” as Bitcoin.pl remarked in its article. Another controversial moment has been the proposal to impose a 0.5% fee on the revenues of Polish crypto exchanges, which is not required by MiCA, while charging foreign-based trading platforms only a one-time fee of around $5,000. Representatives of Poland’s crypto industry have complained that this would hurt their ability to compete with exchanges based abroad. It may even push Polish companies to relocate to more favorable jurisdictions in order to continue to work in their own market. Lawmakers from the opposition highlighted these and other issues with the bill. Janusz Kowalski, from the right-wing conservative Law and Justice (PiS) party suggested such charges should be capped and criticized the idea to grant supervisory powers to the KNF. “Poland has enormous potential in the crypto asset innovation sector. But instead of harnessing it, the Ministry of Finance wants to stifle the development of crypto assets, which is a dramatic reversal of global trends,” Kowalski stated in a post on X, following the parliamentary session. 🔹Polska ma ogromny potencjał w sektorze innowacji kryptoaktywów. Ale zamiast go wykorzystać, @MF_GOV_PL chce zablokować rozwój kryptoaktywów, co jest dramatycznym odwróceniem światowych trendów. 🔹Chcemy jako @pisorgpl , aby polscy informatycy pracowali dla polskich firm, w… pic.twitter.com/ZRTTbMuAW5 — Janusz Kowalski 🇵🇱 (@JKowalski_posel) July 22, 2025 “As PiS, we want Polish IT specialists to work for Polish companies, in Poland—not in the Czech Republic, Malta, or Germany—and for Poland to be the number one investment destination for crypto asset investments,” he insisted, further reasoning: “Therefore, we need simple and sensible regulations regarding crypto assets, not the overregulated law proposed by [Prime Minister] Donald Tusk’s government.” Speaking to the leading Polish daily Gazeta Wyborcza, Kowalski recently announced that if the Sejm does not amend the document, PiS-backed President-elect Karol Nawrocki, who is assuming office in early August, will veto the legislation. “The government’s draft bill fails to meet the fundamental principle that should apply when implementing EU law: ‘EU+zero’,” he stated, rejecting rules added by Polish politicians. The latter “would block the development of crypto assets in Poland for years,” Kowalski warned. Your crypto news deserves attention - KEY Difference Wire puts you on 250+ top sites",cryptopolitan,https://www.cryptopolitan.com/poles-invested-in-crypto-polish-government/,REGULATION|BTC|MARKET|BUSINESS|ETH,Regulation|BTC|ETH|EUR|PLN,BTC,"Poland admits one in five of Poles have invested in crypto during Bitcoin bill debate. Some 18% of Polish citizens have already put money into crypto assets, according to Warsaw’s own estimates made public during a parliamentary debate on Poland’s upcoming cryptocurrency regulations. Members of the Sejm, the lower house of parliament in Poland, are considering a government-sponsored piece of legislation meant to regulate cryptocurrencies like Bitcoin in the country and the economy built around the digital assets. Bill No. 1424 was filed on June 26 and submitted for first reading in the chamber on July 7, the Polish crypto news outlet Bitcoin.pl reported Wednesday. On July 22, deputies launched the long-awaited debate on the proposed regulations, joined by representatives of the executive power in Warsaw. Fifth of Poles already invested in cryptocurrencies, government says Addressing lawmakers from the ruling majority and the opposition, Deputy Finance Minister Jurand Drop defended the cabinet’s motion, stressing that the Central European nation is yet to adopt rules providing protection for crypto investors. “20% of investors in this market declare that they have fallen victim to some kind of fraud or abuse,” the government official pointed out, while also emphasizing: “In Poland, 18% of people already have experience investing in crypto assets. These regulations are crucial for strengthening investor and customer protection in the crypto asset market.” Polish crypto sector fears bill may spark exodus of businesses The new legislation, aimed at transposing the European Union’s Markets in Crypto Assets ( MiCA ) regulation into national law, has been the cause of deep concerns among the members of the local crypto community. A worrying move for them is the decision to entrust oversight to the Polish Financial Supervision Authority ( KNF ), “which is notorious for its less-than-favorable attitude toward cryptocurrencies,” as Bitcoin.pl remarked in its article. Another controversial moment has been the proposal to impose a 0.5% fee on the revenues of Polish crypto exchanges, which is not required by MiCA, while charging foreign-based trading platforms only a one-time fee of around $5,000. Representatives of Poland’s crypto industry have complained that this would hurt their ability to compete with exchanges based abroad. It may even push Polish companies to relocate to more favorable jurisdictions in order to continue to work in their own market. Lawmakers from the opposition highlighted these and other issues with the bill. Janusz Kowalski, from the right-wing conservative Law and Justice (PiS) party suggested such charges should be capped and criticized the idea to grant supervisory powers to the KNF. “Poland has enormous potential in the crypto asset innovation sector. But instead of harnessing it, the Ministry of Finance wants to stifle the development of crypto assets, which is a dramatic reversal of global trends,” Kowalski stated in a post on X, following the parliamentary session. 🔹Polska ma ogromny potencjał w sektorze innowacji kryptoaktywów. Ale zamiast go wykorzystać, @MF_GOV_PL chce zablokować rozwój kryptoaktywów, co jest dramatycznym odwróceniem światowych trendów. 🔹Chcemy jako @pisorgpl , aby polscy informatycy pracowali dla polskich firm, w… pic.twitter.com/ZRTTbMuAW5 — Janusz Kowalski 🇵🇱 (@JKowalski_posel) July 22, 2025 “As PiS, we want Polish IT specialists to work for Polish companies, in Poland—not in the Czech Republic, Malta, or Germany—and for Poland to be the number one investment destination for crypto asset investments,” he insisted, further reasoning: “Therefore, we need simple and sensible regulations regarding crypto assets, not the overregulated law proposed by [Prime Minister] Donald Tusk’s government.” Speaking to the leading Polish daily Gazeta Wyborcza, Kowalski recently announced that if the Sejm does not amend the document, PiS-backed President-elect Karol Nawrocki, who is assuming office in early August, will veto the legislation. “The government’s draft bill fails to meet the fundamental principle that should apply when implementing EU law: ‘EU+zero’,” he stated, rejecting rules added by Polish politicians. The latter “would block the development of crypto assets in Poland for years,” Kowalski warned. Your crypto news deserves attention - KEY Difference Wire puts you on 250+ top sites"
2025-07-24 12:19:53+00:00,Societe Generale May Enhance Liquidity for 21Shares Bitcoin ETPs in European Markets,"🚀 Are You Chasing New Coins? Catch the newest crypto opportunities. Be the first to buy, be the first to win! Click here to discover new altcoins! Societe Generale is",coinotag,https://en.coinotag.com/societe-generale-may-enhance-liquidity-for-21shares-bitcoin-etps-in-european-markets/,BTC|ETH|MARKET|ALTCOIN,Bitcoin|Ethereum|News|BTC|ETH,BTC,"Societe Generale May Enhance Liquidity for 21Shares Bitcoin ETPs in European Markets. 🚀 Are You Chasing New Coins? Catch the newest crypto opportunities. Be the first to buy, be the first to win! Click here to discover new altcoins! Societe Generale is"
2025-07-24 12:28:03+00:00,Crypto groups plead for Trump to stop JPMorgan''s scheme to tax payment data,"Cryptocurrency and financial technology industry groups are calling on President Donald Trump to intervene in the “coordinated attempt” by big banks, led by JPMorgan Chase, to undermine open banking regulations by imposing fees for accessing customer financial data. The plea was outlined in a letter sent on Wednesday to the White House, signed by ten major trade associations representing fintech and digital asset firms, including the Blockchain Association and the Crypto Council for Innovation. These groups claim JPMorgan’s decision to charge third-party fintechs for access to customer account data is a “threat to innovation” and will harm the ecosystem of crypto and digital payments in the United States. JPMorgan to charge for data access Last month, JPMorgan Chase informed third-party data aggregators like Plaid and MX that it will begin charging fees when they access customer banking information. These aggregators provide the data infrastructure to many fintech and crypto services, including moving funds between JPMorgan accounts and platforms like Robinhood or self-custody wallets used for digital assets such as USDC or USDT. Until now, access to this data has generally been free. But under the proposed changes, the bank could charge fees every time an aggregator pulls a customer’s data. These costs are expected to be passed downstream, first to fintech platforms and eventually to end users. One founder told the press that the cost of accessing JPMorgan’s APIs would exceed the company’s total revenue since its founding over a decade ago. Another industry executive said the new charges would effectively “put everyone out of business” unless they raise prices by up to 1,000%. “ The JPMorgan fees make it impossible to serve Chase customers if you are a small company, ” the fintech executive warned. Letter to the White House explains consumer risks The coalition’s letter from the ten companies argues that JPMorgan’s plan could “de-bank” millions of Americans and deny them access to core financial services in crypto , especially for stablecoins. It could nerf the use of self-custody wallets and real-time digital payments, the groups said. “ Let us be clear: financial data belongs to the American people, not the banks ,” the letter read. “ By challenging open banking, the largest banks stand in direct opposition to your vision of making America the financial innovation capital of the world. ” The trade groups are urging the Trump administration to take immediate action before July 29, when it is expected to submit a legal brief in an ongoing federal case over the Consumer Financial Protection Bureau’s (CFPB) new open banking rules, specifically Rule 1033 . The regulation, finalized by the CFPB in late 2024, requires financial institutions to provide consumers with free access to their account data and allows them to share it with third-party providers. Still, financial institutions banks like JPMorgan immediately filed lawsuits to block the rule on the same day it was finalized. The CFPB gave in to legal pressure from the banking industry and asked the courts to vacate the rule. According to industry estimates, if JPMorgan’s plan proceeds, Plaid alone could be forced to pay up to $300 million annually in fees, more than 75% of its current revenue. Kraken co-CEO Arjun Sethi, in a July 12 article written on social platform X, called JPMorgan’s decision to charge fees for data part of a “calculated shift” where banks are monetizing user-generated data and erecting tolls around personal information. “ There is a version of the future where every financial interaction is intermediated by systems that monitor, price, and gate access to your own data, ” Sethi wrote. “ Crypto presents an alternative. But that alternative is not guaranteed. ” Your crypto news deserves attention - KEY Difference Wire puts you on 250+ top sites",cryptopolitan,https://www.cryptopolitan.com/crypto-industry-asks-trump-stop-jpmorgan-tax/,REGULATION|BUSINESS|BTC|ETH|BLOCKCHAIN,News|BTC|CFPB|ETH|JPMorgan,BTC,"Crypto groups plead for Trump to stop JPMorgan''s scheme to tax payment data. Cryptocurrency and financial technology industry groups are calling on President Donald Trump to intervene in the “coordinated attempt” by big banks, led by JPMorgan Chase, to undermine open banking regulations by imposing fees for accessing customer financial data. The plea was outlined in a letter sent on Wednesday to the White House, signed by ten major trade associations representing fintech and digital asset firms, including the Blockchain Association and the Crypto Council for Innovation. These groups claim JPMorgan’s decision to charge third-party fintechs for access to customer account data is a “threat to innovation” and will harm the ecosystem of crypto and digital payments in the United States. JPMorgan to charge for data access Last month, JPMorgan Chase informed third-party data aggregators like Plaid and MX that it will begin charging fees when they access customer banking information. These aggregators provide the data infrastructure to many fintech and crypto services, including moving funds between JPMorgan accounts and platforms like Robinhood or self-custody wallets used for digital assets such as USDC or USDT. Until now, access to this data has generally been free. But under the proposed changes, the bank could charge fees every time an aggregator pulls a customer’s data. These costs are expected to be passed downstream, first to fintech platforms and eventually to end users. One founder told the press that the cost of accessing JPMorgan’s APIs would exceed the company’s total revenue since its founding over a decade ago. Another industry executive said the new charges would effectively “put everyone out of business” unless they raise prices by up to 1,000%. “ The JPMorgan fees make it impossible to serve Chase customers if you are a small company, ” the fintech executive warned. Letter to the White House explains consumer risks The coalition’s letter from the ten companies argues that JPMorgan’s plan could “de-bank” millions of Americans and deny them access to core financial services in crypto , especially for stablecoins. It could nerf the use of self-custody wallets and real-time digital payments, the groups said. “ Let us be clear: financial data belongs to the American people, not the banks ,” the letter read. “ By challenging open banking, the largest banks stand in direct opposition to your vision of making America the financial innovation capital of the world. ” The trade groups are urging the Trump administration to take immediate action before July 29, when it is expected to submit a legal brief in an ongoing federal case over the Consumer Financial Protection Bureau’s (CFPB) new open banking rules, specifically Rule 1033 . The regulation, finalized by the CFPB in late 2024, requires financial institutions to provide consumers with free access to their account data and allows them to share it with third-party providers. Still, financial institutions banks like JPMorgan immediately filed lawsuits to block the rule on the same day it was finalized. The CFPB gave in to legal pressure from the banking industry and asked the courts to vacate the rule. According to industry estimates, if JPMorgan’s plan proceeds, Plaid alone could be forced to pay up to $300 million annually in fees, more than 75% of its current revenue. Kraken co-CEO Arjun Sethi, in a July 12 article written on social platform X, called JPMorgan’s decision to charge fees for data part of a “calculated shift” where banks are monetizing user-generated data and erecting tolls around personal information. “ There is a version of the future where every financial interaction is intermediated by systems that monitor, price, and gate access to your own data, ” Sethi wrote. “ Crypto presents an alternative. But that alternative is not guaranteed. ” Your crypto news deserves attention - KEY Difference Wire puts you on 250+ top sites"
2025-07-24 12:28:13+00:00,Massive Dormant Bitcoin Whale Transfer Sparks Market Speculation Without Clear Intentions,"🚀 Are You Chasing New Coins? Catch the newest crypto opportunities. Be the first to buy, be the first to win! Click here to discover new altcoins! A recent colossal",coinotag,https://en.coinotag.com/massive-dormant-bitcoin-whale-transfer-sparks-market-speculation-without-clear-intentions/,BTC|MARKET|ALTCOIN,Analysis|Bitcoin|News|BTC,BTC,"Massive Dormant Bitcoin Whale Transfer Sparks Market Speculation Without Clear Intentions. 🚀 Are You Chasing New Coins? Catch the newest crypto opportunities. Be the first to buy, be the first to win! Click here to discover new altcoins! A recent colossal"
2025-07-24 12:30:38+00:00,UK firm smashes local Bitcoin treasury record with $135M raise,"Satsuma Technology has raised $135 million to fund one of the UK''s largest single Bitcoin treasury acquisitions, positioning itself as a top regional BTC holder.",cointelegraph,https://cointelegraph.com/news/uk-firm-smashes-2025-local-bitcoin-treasury-record-with-135m-raise?utm_source=rss_feed&utm_medium=rss&utm_campaign=rss_partner_inbound,BTC|REGULATION|TREASURY|TECHNOLOGY,,BTC,"UK firm smashes local Bitcoin treasury record with $135M raise. Satsuma Technology has raised $135 million to fund one of the UK''s largest single Bitcoin treasury acquisitions, positioning itself as a top regional BTC holder."
2025-07-24 12:32:00+00:00,"Satoshi-Era Bitcoin Whale with $468,046,931 BTC Exposed After 14.5 Years’ Sleep","Ancient Bitcoin whale comes back with BTC bought back in 2011 and 32,212,400% profit",utoday,https://u.today/satoshi-era-bitcoin-whale-with-468046931-btc-exposed-after-145-years-sleep,BTC|BUSINESS,Bitcoin|BTC,BTC,"Satoshi-Era Bitcoin Whale with $468,046,931 BTC Exposed After 14.5 Years’ Sleep. Ancient Bitcoin whale comes back with BTC bought back in 2011 and 32,212,400% profit"
2025-07-24 12:32:32+00:00,Satsuma Technology Raises $135 Million to Potentially Acquire One of UK’s Largest Bitcoin Treasuries,"🚀 Are You Chasing New Coins? Catch the newest crypto opportunities. Be the first to buy, be the first to win! Click here to discover new altcoins! Satsuma Technology has",coinotag,https://en.coinotag.com/satsuma-technology-raises-135-million-to-potentially-acquire-one-of-uks-largest-bitcoin-treasuries/,BTC|TECHNOLOGY|BITTENSOR|ALTCOIN,Bitcoin|News|BTC|TAO,BTC,"Satsuma Technology Raises $135 Million to Potentially Acquire One of UK’s Largest Bitcoin Treasuries. 🚀 Are You Chasing New Coins? Catch the newest crypto opportunities. Be the first to buy, be the first to win! Click here to discover new altcoins! Satsuma Technology has"
2025-07-24 12:33:01+00:00,Bitcoin Breakdown? BTC Price Analysis Warns of Sharp Drop Below $111K,"Bitcoin’s consolidation has been extended, with the price hovering around the $120K price range. A break below the $116K support is expected, likely pushing the price down toward the $111K region. Technical Analysis By ShayanMarkets The Daily Chart Bitcoin’s price consolidation continues just below its all-time high of $123K, hovering between the $116K and $120K levels. This price behavior signals an equilibrium zone, where buying and selling pressure are currently balanced, a sign that the market awaits a fresh catalyst. Importantly, this range also aligns with the 0.5-0.618 levels of the Trend-Based Fibonacci Extension, adding further technical significance to the current resistance zone. Given the lack of strong bullish momentum, a deeper correction below $116K is likely, with the $111K zone emerging as the next key target. The 4-Hour Chart On the lower timeframe, BTC appears to be forming a bullish flag — a classic continuation pattern. Despite multiple rebounds from the $116K support, repeated testing suggests growing vulnerability. These reactions have likely created a sell-side liquidity pool just below $116K, increasing the probability of a liquidity sweep followed by a bearish breakout. Should this support level fail, the asset could swiftly decline toward the flag’s lower boundary near $111K. On-chain Analysis By ShayanMarkets The Binance BTC/USDT Liquidation Heatmap reveals a critical tug-of-war in the current market structure. Bitcoin’s price is currently trapped between two major liquidity clusters, with significant liquidation pools above $120K and below $116K. These zones represent a high concentration of leveraged futures positions, making them prime targets for smart money and market makers seeking liquidity. A price move toward either level could trigger a cascade of liquidations, intensifying volatility and rapidly accelerating price action. As a result, Bitcoin remains range-bound between these two zones until one side is taken out. A breakout above $120K or a breakdown below $116K will likely lead to a sharp, directional move, fueled by stop-losses and forced liquidations. Traders should keep a close eye on these levels and prepare for potential whipsaw volatility once either threshold is breached. The post Bitcoin Breakdown? BTC Price Analysis Warns of Sharp Drop Below $111K appeared first on CryptoPotato .",cryptopotato,https://cryptopotato.com/bitcoin-breakdown-btc-price-analysis-warns-of-sharp-drop-below-111k/,TRADING|BTC|MARKET|BNB|EXCHANGE,BTC Analysis|BTCEUR|BTCGBP|BTCUSD|BTCUSDT|Crypto News|Bitcoin (BTC) Price,BTC,"Bitcoin Breakdown? BTC Price Analysis Warns of Sharp Drop Below $111K. Bitcoin’s consolidation has been extended, with the price hovering around the $120K price range. A break below the $116K support is expected, likely pushing the price down toward the $111K region. Technical Analysis By ShayanMarkets The Daily Chart Bitcoin’s price consolidation continues just below its all-time high of $123K, hovering between the $116K and $120K levels. This price behavior signals an equilibrium zone, where buying and selling pressure are currently balanced, a sign that the market awaits a fresh catalyst. Importantly, this range also aligns with the 0.5-0.618 levels of the Trend-Based Fibonacci Extension, adding further technical significance to the current resistance zone. Given the lack of strong bullish momentum, a deeper correction below $116K is likely, with the $111K zone emerging as the next key target. The 4-Hour Chart On the lower timeframe, BTC appears to be forming a bullish flag — a classic continuation pattern. Despite multiple rebounds from the $116K support, repeated testing suggests growing vulnerability. These reactions have likely created a sell-side liquidity pool just below $116K, increasing the probability of a liquidity sweep followed by a bearish breakout. Should this support level fail, the asset could swiftly decline toward the flag’s lower boundary near $111K. On-chain Analysis By ShayanMarkets The Binance BTC/USDT Liquidation Heatmap reveals a critical tug-of-war in the current market structure. Bitcoin’s price is currently trapped between two major liquidity clusters, with significant liquidation pools above $120K and below $116K. These zones represent a high concentration of leveraged futures positions, making them prime targets for smart money and market makers seeking liquidity. A price move toward either level could trigger a cascade of liquidations, intensifying volatility and rapidly accelerating price action. As a result, Bitcoin remains range-bound between these two zones until one side is taken out. A breakout above $120K or a breakdown below $116K will likely lead to a sharp, directional move, fueled by stop-losses and forced liquidations. Traders should keep a close eye on these levels and prepare for potential whipsaw volatility once either threshold is breached. The post Bitcoin Breakdown? BTC Price Analysis Warns of Sharp Drop Below $111K appeared first on CryptoPotato ."
