DATETIME,HEADLINE,SUMMARY,SOURCE,URL,CATEGORIES,TAGS,asset,text
2025-07-23 14:29:28+00:00,MARA Holdings To Raise $850M As It Doubles Down On Bitcoin,"The post MARA Holdings To Raise $850M As It Doubles Down On Bitcoin appeared first on Coinpedia Fintech News Bitcoin miner MARA Holdings is making bold moves. According to a recent announcement, the company is all set to raise $850 million to expand its Bitcoin holdings and support other initiatives. MARA Holdings plans to raise $850 million through a private offering of zero-interest convertible notes due in 2032. These notes can later be converted into cash, MARA stock, or a mix of both. An extra $150 million may also be offered depending on demand. Out of the funds raised, $50 million could go toward buying back some of MARA’s older debt (1% notes due 2026). The rest will be used for buying more Bitcoin, general business needs, and possibly paying down other debts or funding strategic growth. Already holding over 50,000 BTC, MARA is doubling down on its crypto bet. MARA is the second-largest public company holding Bitcoin, just behind Microstrategy, which holds over 600,000 BTC. Bitcoin recently hit an all-time high of $123,000, but has slipped back to around $116K. However, large institutions are not backing off and continue to invest heavily, showing strong confidence in its long-term potential.",coinpedia,https://coinpedia.org/news/mara-holdings-to-raise-850m-as-it-doubles-down-on-bitcoin/,BTC|BUSINESS,News|Bitcoin,BTC,"MARA Holdings To Raise $850M As It Doubles Down On Bitcoin. The post MARA Holdings To Raise $850M As It Doubles Down On Bitcoin appeared first on Coinpedia Fintech News Bitcoin miner MARA Holdings is making bold moves. According to a recent announcement, the company is all set to raise $850 million to expand its Bitcoin holdings and support other initiatives. MARA Holdings plans to raise $850 million through a private offering of zero-interest convertible notes due in 2032. These notes can later be converted into cash, MARA stock, or a mix of both. An extra $150 million may also be offered depending on demand. Out of the funds raised, $50 million could go toward buying back some of MARA’s older debt (1% notes due 2026). The rest will be used for buying more Bitcoin, general business needs, and possibly paying down other debts or funding strategic growth. Already holding over 50,000 BTC, MARA is doubling down on its crypto bet. MARA is the second-largest public company holding Bitcoin, just behind Microstrategy, which holds over 600,000 BTC. Bitcoin recently hit an all-time high of $123,000, but has slipped back to around $116K. However, large institutions are not backing off and continue to invest heavily, showing strong confidence in its long-term potential."
2025-07-23 14:30:26+00:00,"Demand to the ‘Order of Trillions’ Could Be Coming for US Debt, According to Treasury Deputy Secretary Michael Faulkender – Here’s How","Trillions of dollars could flow into the US Treasury market following the approval of a landmark stablecoin bill, according to Treasury Deputy Secretary Michael Faulkender. Last week, President Trump signed the GENIUS Act into law, establishing a regulatory framework for stablecoins, cryptocurrencies pegged to the US dollar, requiring each token to be fully backed by liquid assets such as cash or short-term US Treasuries. In a new Bloomberg interview, Faulkender explains in detail how the passage of the stablecoin bill into law would translate to massive demand for US debt. “We now have a digital asset that has rules of the road established by Congress for what backs those digital assets. It provides enormous amounts of confidence to not only Americans, but our trading partners around the world, who are then willing to make exchanges, to invoice dollars and then be paid via stablecoins because they know that it is an asset that has a value behind it. Because what is it that backs it? Primarily, it’s going to be T-bills.” Faulkender notes that while wiring money abroad typically takes a day or two to settle, stablecoins can deliver funds in just seconds. “And so it’s going to enormously hasten the timeframe for making payments. It’s more secure, it’s more private, it’s significantly cheaper. And so if indeed this does revolutionize the way that international payments are invoiced and paid, then there should be a flocking to this technology. And if all of that trade therefore is even further denominated in stablecoins, then there’s going to be demand for the underlying asset, which are Treasury securities. We could potentially see on the order of trillions of additional demand.” Follow us on X , Facebook and Telegram Don''t Miss a Beat – Subscribe to get email alerts delivered directly to your inbox Check Price Action Surf The Daily Hodl Mix Disclaimer: Opinions expressed at The Daily Hodl are not investment advice. Investors should do their due diligence before making any high-risk investments in Bitcoin, cryptocurrency or digital assets. Please be advised that your transfers and trades are at your own risk, and any losses you may incur are your responsibility. The Daily Hodl does not recommend the buying or selling of any cryptocurrencies or digital assets, nor is The Daily Hodl an investment advisor. Please note that The Daily Hodl participates in affiliate marketing. Generated Image: Midjourney The post Demand to the ‘Order of Trillions’ Could Be Coming for US Debt, According to Treasury Deputy Secretary Michael Faulkender – Here’s How appeared first on The Daily Hodl .",dailyhodl,https://dailyhodl.com/2025/07/23/demand-to-the-order-of-trillions-could-be-coming-for-us-debt-according-to-treasury-deputy-secretary-michael-faulkender-heres-how/,REGULATION|TRADING|BTC|BUSINESS|MARKET,Financeflux|Genius act|News|stablecoins|US Debt|US Treasuries,BTC,"Demand to the ‘Order of Trillions’ Could Be Coming for US Debt, According to Treasury Deputy Secretary Michael Faulkender – Here’s How. Trillions of dollars could flow into the US Treasury market following the approval of a landmark stablecoin bill, according to Treasury Deputy Secretary Michael Faulkender. Last week, President Trump signed the GENIUS Act into law, establishing a regulatory framework for stablecoins, cryptocurrencies pegged to the US dollar, requiring each token to be fully backed by liquid assets such as cash or short-term US Treasuries. In a new Bloomberg interview, Faulkender explains in detail how the passage of the stablecoin bill into law would translate to massive demand for US debt. “We now have a digital asset that has rules of the road established by Congress for what backs those digital assets. It provides enormous amounts of confidence to not only Americans, but our trading partners around the world, who are then willing to make exchanges, to invoice dollars and then be paid via stablecoins because they know that it is an asset that has a value behind it. Because what is it that backs it? Primarily, it’s going to be T-bills.” Faulkender notes that while wiring money abroad typically takes a day or two to settle, stablecoins can deliver funds in just seconds. “And so it’s going to enormously hasten the timeframe for making payments. It’s more secure, it’s more private, it’s significantly cheaper. And so if indeed this does revolutionize the way that international payments are invoiced and paid, then there should be a flocking to this technology. And if all of that trade therefore is even further denominated in stablecoins, then there’s going to be demand for the underlying asset, which are Treasury securities. We could potentially see on the order of trillions of additional demand.” Follow us on X , Facebook and Telegram Don''t Miss a Beat – Subscribe to get email alerts delivered directly to your inbox Check Price Action Surf The Daily Hodl Mix Disclaimer: Opinions expressed at The Daily Hodl are not investment advice. Investors should do their due diligence before making any high-risk investments in Bitcoin, cryptocurrency or digital assets. Please be advised that your transfers and trades are at your own risk, and any losses you may incur are your responsibility. The Daily Hodl does not recommend the buying or selling of any cryptocurrencies or digital assets, nor is The Daily Hodl an investment advisor. Please note that The Daily Hodl participates in affiliate marketing. Generated Image: Midjourney The post Demand to the ‘Order of Trillions’ Could Be Coming for US Debt, According to Treasury Deputy Secretary Michael Faulkender – Here’s How appeared first on The Daily Hodl ."
2025-07-23 14:31:20+00:00,Binance CEO Highlights Potential Trends Shaping Bitcoin and the Future of Crypto Finance,"🚀 Are You Chasing New Coins? Catch the newest crypto opportunities. Be the first to buy, be the first to win! Click here to discover new altcoins! Binance CEO Richard",coinotag,https://en.coinotag.com/binance-ceo-highlights-potential-trends-shaping-bitcoin-and-the-future-of-crypto-finance/,BTC|BNB|EXCHANGE|ADA|SOL,News|ADA|BTC|SOL|XLM,BTC,"Binance CEO Highlights Potential Trends Shaping Bitcoin and the Future of Crypto Finance. 🚀 Are You Chasing New Coins? Catch the newest crypto opportunities. Be the first to buy, be the first to win! Click here to discover new altcoins! Binance CEO Richard"
2025-07-23 14:33:36+00:00,"Bitcoin Price Faces Potential Retracement as Liquidity Targets $117,500 Amid Market Volatility and Rising Altcoin Froth","🚀 Are You Chasing New Coins? Catch the newest crypto opportunities. Be the first to buy, be the first to win! Click here to discover new altcoins! Bitcoin’s recent price",coinotag,https://en.coinotag.com/bitcoin-price-faces-potential-retracement-as-liquidity-targets-117500-amid-market-volatility-and-rising-altcoin-froth/,BTC|MARKET|ALTCOIN|TRADING,Analysis|Bitcoin|News|AUCTION|BTC,BTC,"Bitcoin Price Faces Potential Retracement as Liquidity Targets $117,500 Amid Market Volatility and Rising Altcoin Froth. 🚀 Are You Chasing New Coins? Catch the newest crypto opportunities. Be the first to buy, be the first to win! Click here to discover new altcoins! Bitcoin’s recent price"
2025-07-23 14:37:39+00:00,"Bitcoin Surges Past $118,000 with Minimal 24-Hour Decline, Data Shows","🚀 Are You Chasing New Coins? Catch the newest crypto opportunities. Be the first to buy, be the first to win! Click here to discover new altcoins! On July 23,",coinotag,https://en.coinotag.com/breakingnews/bitcoin-surges-past-118000-with-minimal-24-hour-decline-data-shows/,BTC|ALTCOIN,BTC,BTC,"Bitcoin Surges Past $118,000 with Minimal 24-Hour Decline, Data Shows. 🚀 Are You Chasing New Coins? Catch the newest crypto opportunities. Be the first to buy, be the first to win! Click here to discover new altcoins! On July 23,"
2025-07-23 14:39:34+00:00,Cango Inc. Announces Completion of Secondary Acquisition and Appointment of New Leadership Team,"HONG KONG, July 23, 2025 /PRNewswire/ -- Cango Inc. (NYSE: CANG) today announced its transformation into a global Bitcoin miner with the appointment of a new Board of Directors (the ""Board"") and senior management team with deep expertise in digital-asset infrastructure, finance, and energy investments. On July 23, 2025, the Board appointed (i) Mr. Xin Jin as Chairman of the Board and Non-Executive Director, (ii) Mr. Peng Yu as CEO and Director, (iii) Mr. Chang-Wei Chiu as Director, (iv) Mr. Yongyi Zhang as CFO and (v) Mr. Simon Ming Yeung Tang as CIO To strengthen governance, the Board also appointed (i) Mr. Chi Ming Lee, Independent Director, as a member of the Compensation Committee and Nominating and Corporate Governance Committee, (ii) Mr. Yanjun Lin, Independent Director, as Chairman of the Compensation Committee and member of the Nominating and Corporate Governance Committee, and (iii) Mr. Haitian Lu as Chairman of the Nominating and Corporate Governance Committee and member of the Compensation Committee. The Board also accepted the resignations of Mr. Xiaojun Zhang as Director and Chairman, and Mr. Jiayuan Lin as CEO, Interim CFO, and Director. All changes are effective immediately. Mr. Peng Yu, CEO and Director, commented, ""This leadership team gives Cango the right mix of skills to execute our next phase of growth. Having successfully transformed into a Bitcoin miner, we have already made remarkable progress in the past 7 months by becoming one of the largest Bitcoin miners in the world. With a strong balance sheet and clear long-term vision, our collective experience will help us scale beyond the 50 EH/s already deployed, not only safeguarding but strategically growing our treasury of more than 4,000 Bitcoins to maximize shareholder value. We will begin developing sustainable, high-performance computing opportunities while strategically expanding upstream into dedicated power resources especially green energy that will create lasting value for shareholders and drive further growth."" Mr. Xiaojun Zhang and Mr. Jiayuan Lin resigned as co-founders coinciding with a secondary sale of 10 million Class B shares to Enduring Wealth Capital Limited for US$70 million. They converted their remaining Class B shares into Class A shares, now holding 18.54% of total outstanding shares and 12.07% of voting power. Enduring Wealth Capital Limited now holds about 2.82% of outstanding shares and 36.73% of voting power.. Full article: https://ir-image.cangoonline.com/ir-documents/2025-07-23_Cango%20Inc.%20Announces%20Completion%20of%20Secondary%20Acquisition%20and%20Appointment%20of%20New%20Leadership%20Team.pdf Investor Relations Contact Juliet YE, Head of CommunicationsCango Inc.Email: ir@cangoonline.com Disclaimer: This is a sponsored press release and is for informational purposes only. It does not reflect the views of Crypto Daily, nor is it intended to be used as legal, tax, investment, or financial advice.",cryptodaily,https://cryptodaily.co.uk/2025/07/cango-inc-announces-completion-of-secondary-acquisition-and-appointment-of-new-leadership-team,SPONSORED|BTC|REGULATION|BUSINESS|TREASURY,More News,BTC,"Cango Inc. Announces Completion of Secondary Acquisition and Appointment of New Leadership Team. HONG KONG, July 23, 2025 /PRNewswire/ -- Cango Inc. (NYSE: CANG) today announced its transformation into a global Bitcoin miner with the appointment of a new Board of Directors (the ""Board"") and senior management team with deep expertise in digital-asset infrastructure, finance, and energy investments. On July 23, 2025, the Board appointed (i) Mr. Xin Jin as Chairman of the Board and Non-Executive Director, (ii) Mr. Peng Yu as CEO and Director, (iii) Mr. Chang-Wei Chiu as Director, (iv) Mr. Yongyi Zhang as CFO and (v) Mr. Simon Ming Yeung Tang as CIO To strengthen governance, the Board also appointed (i) Mr. Chi Ming Lee, Independent Director, as a member of the Compensation Committee and Nominating and Corporate Governance Committee, (ii) Mr. Yanjun Lin, Independent Director, as Chairman of the Compensation Committee and member of the Nominating and Corporate Governance Committee, and (iii) Mr. Haitian Lu as Chairman of the Nominating and Corporate Governance Committee and member of the Compensation Committee. The Board also accepted the resignations of Mr. Xiaojun Zhang as Director and Chairman, and Mr. Jiayuan Lin as CEO, Interim CFO, and Director. All changes are effective immediately. Mr. Peng Yu, CEO and Director, commented, ""This leadership team gives Cango the right mix of skills to execute our next phase of growth. Having successfully transformed into a Bitcoin miner, we have already made remarkable progress in the past 7 months by becoming one of the largest Bitcoin miners in the world. With a strong balance sheet and clear long-term vision, our collective experience will help us scale beyond the 50 EH/s already deployed, not only safeguarding but strategically growing our treasury of more than 4,000 Bitcoins to maximize shareholder value. We will begin developing sustainable, high-performance computing opportunities while strategically expanding upstream into dedicated power resources especially green energy that will create lasting value for shareholders and drive further growth."" Mr. Xiaojun Zhang and Mr. Jiayuan Lin resigned as co-founders coinciding with a secondary sale of 10 million Class B shares to Enduring Wealth Capital Limited for US$70 million. They converted their remaining Class B shares into Class A shares, now holding 18.54% of total outstanding shares and 12.07% of voting power. Enduring Wealth Capital Limited now holds about 2.82% of outstanding shares and 36.73% of voting power.. Full article: https://ir-image.cangoonline.com/ir-documents/2025-07-23_Cango%20Inc.%20Announces%20Completion%20of%20Secondary%20Acquisition%20and%20Appointment%20of%20New%20Leadership%20Team.pdf Investor Relations Contact Juliet YE, Head of CommunicationsCango Inc.Email: ir@cangoonline.com Disclaimer: This is a sponsored press release and is for informational purposes only. It does not reflect the views of Crypto Daily, nor is it intended to be used as legal, tax, investment, or financial advice."
2025-07-23 14:41:01+00:00,Cango Inc. Announces Completion of Secondary Acquisition and Appointment of New Leadership Team,"BitcoinWorld Cango Inc. Announces Completion of Secondary Acquisition and Appointment of New Leadership Team HONG KONG , July 23, 2025 /PRNewswire/ — Cango Inc. (NYSE: CANG) today announced its transformation into a global Bitcoin miner with the appointment of a new Board of Directors (the “Board”) and senior management team with deep expertise in digital-asset infrastructure, finance, and energy investments. On July 23, 2025 , the Board appointed (i) Mr. Xin Jin as Chairman of the Board and Non-Executive Director, (ii) Mr. Peng Yu as CEO and Director, (iii) Mr. Chang-Wei Chiu as Director, (iv) Mr. Yongyi Zhang as CFO and (v) Mr. Simon Ming Yeung Tang as CIO To strengthen governance, the Board also appointed (i) Mr. Chi Ming Lee , Independent Director, as a member of the Compensation Committee and Nominating and Corporate Governance Committee, (ii) Mr. Yanjun Lin , Independent Director, as Chairman of the Compensation Committee and member of the Nominating and Corporate Governance Committee, and (iii) Mr. Haitian Lu as Chairman of the Nominating and Corporate Governance Committee and member of the Compensation Committee. The Board also accepted the resignations of Mr. Xiaojun Zhang as Director and Chairman, and Mr. Jiayuan Lin as CEO, Interim CFO, and Director. All changes are effective immediately. Mr. Peng Yu , CEO and Director, commented, “This leadership team gives Cango the right mix of skills to execute our next phase of growth. Having successfully transformed into a Bitcoin miner, we have already made remarkable progress in the past 7 months by becoming one of the largest Bitcoin miners in the world. With a strong balance sheet and clear long-term vision, our collective experience will help us scale beyond the 50 EH/s already deployed, not only safeguarding but strategically growing our treasury of more than 4,000 Bitcoins to maximize shareholder value. We will begin developing sustainable, high-performance computing opportunities while strategically expanding upstream into dedicated power resources especially green energy that will create lasting value for shareholders and drive further growth.” Mr. Xiaojun Zhang and Mr. Jiayuan Lin resigned as co-founders coinciding with a secondary sale of 10 million Class B shares to Enduring Wealth Capital Limited for US$70 million . They converted their remaining Class B shares into Class A shares, now holding 18.54% of total outstanding shares and 12.07% of voting power. Enduring Wealth Capital Limited now holds about 2.82% of outstanding shares and 36.73% of voting power.. Full article: https://ir-image.cangoonline.com/ir-documents/2025-07-23_Cango%20Inc.%20Announces%20Completion%20of%20Secondary%20Acquisition%20and%20Appointment%20of%20New%20Leadership%20Team.pdf Investor Relations Contact Juliet YE, Head of Communications Cango Inc. Email: ir@cangoonline.com This post Cango Inc. Announces Completion of Secondary Acquisition and Appointment of New Leadership Team first appeared on BitcoinWorld and is written by chainwire",bitcoinworld,https://bitcoinworld.co.in/cango-inc-announces-completion-of-secondary-acquisition-and-appointment-of-new-leadership-team/,BTC|BUSINESS|REGULATION|TREASURY,Press Release,BTC,"Cango Inc. Announces Completion of Secondary Acquisition and Appointment of New Leadership Team. BitcoinWorld Cango Inc. Announces Completion of Secondary Acquisition and Appointment of New Leadership Team HONG KONG , July 23, 2025 /PRNewswire/ — Cango Inc. (NYSE: CANG) today announced its transformation into a global Bitcoin miner with the appointment of a new Board of Directors (the “Board”) and senior management team with deep expertise in digital-asset infrastructure, finance, and energy investments. On July 23, 2025 , the Board appointed (i) Mr. Xin Jin as Chairman of the Board and Non-Executive Director, (ii) Mr. Peng Yu as CEO and Director, (iii) Mr. Chang-Wei Chiu as Director, (iv) Mr. Yongyi Zhang as CFO and (v) Mr. Simon Ming Yeung Tang as CIO To strengthen governance, the Board also appointed (i) Mr. Chi Ming Lee , Independent Director, as a member of the Compensation Committee and Nominating and Corporate Governance Committee, (ii) Mr. Yanjun Lin , Independent Director, as Chairman of the Compensation Committee and member of the Nominating and Corporate Governance Committee, and (iii) Mr. Haitian Lu as Chairman of the Nominating and Corporate Governance Committee and member of the Compensation Committee. The Board also accepted the resignations of Mr. Xiaojun Zhang as Director and Chairman, and Mr. Jiayuan Lin as CEO, Interim CFO, and Director. All changes are effective immediately. Mr. Peng Yu , CEO and Director, commented, “This leadership team gives Cango the right mix of skills to execute our next phase of growth. Having successfully transformed into a Bitcoin miner, we have already made remarkable progress in the past 7 months by becoming one of the largest Bitcoin miners in the world. With a strong balance sheet and clear long-term vision, our collective experience will help us scale beyond the 50 EH/s already deployed, not only safeguarding but strategically growing our treasury of more than 4,000 Bitcoins to maximize shareholder value. We will begin developing sustainable, high-performance computing opportunities while strategically expanding upstream into dedicated power resources especially green energy that will create lasting value for shareholders and drive further growth.” Mr. Xiaojun Zhang and Mr. Jiayuan Lin resigned as co-founders coinciding with a secondary sale of 10 million Class B shares to Enduring Wealth Capital Limited for US$70 million . They converted their remaining Class B shares into Class A shares, now holding 18.54% of total outstanding shares and 12.07% of voting power. Enduring Wealth Capital Limited now holds about 2.82% of outstanding shares and 36.73% of voting power.. Full article: https://ir-image.cangoonline.com/ir-documents/2025-07-23_Cango%20Inc.%20Announces%20Completion%20of%20Secondary%20Acquisition%20and%20Appointment%20of%20New%20Leadership%20Team.pdf Investor Relations Contact Juliet YE, Head of Communications Cango Inc. Email: ir@cangoonline.com This post Cango Inc. Announces Completion of Secondary Acquisition and Appointment of New Leadership Team first appeared on BitcoinWorld and is written by chainwire"
2025-07-23 14:43:00+00:00,Bitcoin Price Short-Term Fate Rests on This Key Support Zone: Details,Bitcoin''s (BTC) most crucial short-term price level revealed by on-chain data,utoday,https://u.today/bitcoin-price-short-term-fate-rests-on-this-key-support-zone-details,BTC|TRADING,Bitcoin|BTC,BTC,Bitcoin Price Short-Term Fate Rests on This Key Support Zone: Details. Bitcoin''s (BTC) most crucial short-term price level revealed by on-chain data
2025-07-23 14:45:00+00:00,Crypto ATMs were just banned in New Zealand: Here’s why it matters,"New Zealand’s financial watchdog outlawed crypto ATMs, citing regulatory gaps and AML concerns and raising questions about retail access and compliance.",Cointelegraph,https://cointelegraph.com/explained/crypto-atms-were-just-banned-in-new-zealand-heres-why-it-matters?utm_source=rss_feed&utm_medium=rss&utm_campaign=rss_partner_inbound,,,BTC,"Crypto ATMs were just banned in New Zealand: Here’s why it matters. New Zealand’s financial watchdog outlawed crypto ATMs, citing regulatory gaps and AML concerns and raising questions about retail access and compliance."
