DATETIME,HEADLINE,SUMMARY,SOURCE,URL,CATEGORIES,TAGS,asset,text
2025-07-28 12:51:55+00:00,XRP Sees Increased Institutional Inflows Amid Capital Rotation and Bitcoin Outflows,"🚀 Are You Chasing New Coins? Catch the newest crypto opportunities. Be the first to buy, be the first to win! Click here to discover new altcoins! XRP is regaining",coinotag,https://en.coinotag.com/xrp-sees-increased-institutional-inflows-amid-capital-rotation-and-bitcoin-outflows/,XRP|BTC|ETH|ALTCOIN,News|BTC|ETH|XRP,BTC,"XRP Sees Increased Institutional Inflows Amid Capital Rotation and Bitcoin Outflows. 🚀 Are You Chasing New Coins? Catch the newest crypto opportunities. Be the first to buy, be the first to win! Click here to discover new altcoins! XRP is regaining"
2025-07-28 12:54:09+00:00,Ethereum ETFs May Continue Outpacing Bitcoin as July Sees Record $11.2 Billion ETF Inflows,"🚀 Are You Chasing New Coins? Catch the newest crypto opportunities. Be the first to buy, be the first to win! Click here to discover new altcoins! Bitcoin and Ethereum",coinotag,https://en.coinotag.com/ethereum-etfs-may-continue-outpacing-bitcoin-as-july-sees-record-11-2-billion-etf-inflows/,BTC|ETH|ALTCOIN,News|BTC|ETH,BTC,"Ethereum ETFs May Continue Outpacing Bitcoin as July Sees Record $11.2 Billion ETF Inflows. 🚀 Are You Chasing New Coins? Catch the newest crypto opportunities. Be the first to buy, be the first to win! Click here to discover new altcoins! Bitcoin and Ethereum"
2025-07-28 12:54:10+00:00,MARA Raises $900 Million to Boost Bitcoin Mining Power,"The post MARA Raises $900 Million to Boost Bitcoin Mining Power appeared first on Coinpedia Fintech News Publicly traded Bitcoin mining company MARA has raised a staggering $900 million to expand its BTC reserves. This move signals continued confidence in Bitcoin’s long-term value and positions MARA as a dominant force in the mining sector. The funds will likely go toward increasing mining capacity and direct Bitcoin purchases. With market momentum building, MARA’s bold strategy highlights growing institutional appetite for crypto and could inspire similar moves across the mining industry.",coinpedia,https://coinpedia.org/crypto-live-news/mara-raises-900-million-to-boost-bitcoin-mining-power/,BTC|MINING|MARKET,Short News|Fintech Company,BTC,"MARA Raises $900 Million to Boost Bitcoin Mining Power. The post MARA Raises $900 Million to Boost Bitcoin Mining Power appeared first on Coinpedia Fintech News Publicly traded Bitcoin mining company MARA has raised a staggering $900 million to expand its BTC reserves. This move signals continued confidence in Bitcoin’s long-term value and positions MARA as a dominant force in the mining sector. The funds will likely go toward increasing mining capacity and direct Bitcoin purchases. With market momentum building, MARA’s bold strategy highlights growing institutional appetite for crypto and could inspire similar moves across the mining industry."
2025-07-28 12:55:10+00:00,Mara Bitcoin Mining: Unlocking a Massive $950M for Future Growth,"BitcoinWorld Mara Bitcoin Mining: Unlocking a Massive $950M for Future Growth The cryptocurrency world is buzzing with significant financial moves, and U.S.-based crypto mining giant MARA Holdings has just made headlines with a strategic funding initiative that could reshape its future. In a move signaling robust confidence in its growth trajectory and the long-term potential of digital assets, Mara Bitcoin Mining has successfully completed a substantial $950 million offering of 0% convertible senior notes due 2032. This monumental raise, as reported via a GlobeNewswire press release, is poised to fuel the company’s ambitious plans, primarily focusing on expanding its Bitcoin reserves, settling existing debts, and bolstering general corporate operations. But what exactly do these “convertible notes” mean, and how will this capital infusion impact the broader crypto landscape? What are Convertible Notes and Why are they Strategic for Mara Bitcoin Mining ? To fully grasp the significance of MARA Holdings’ latest financial maneuver, it’s essential to understand the instrument at its core: convertible senior notes. These aren’t your everyday loans. Think of them as a hybrid financial product, blending elements of both debt and equity. Here’s a quick breakdown: Debt Component: Initially, these notes function like bonds. Investors lend money to the company (MARA Holdings) and typically receive interest payments. In this specific case, the notes are 0% interest, making them particularly attractive for MARA as they avoid immediate cash outflows for interest. Equity Component: The “convertible” aspect is key. At a pre-determined future date, or under specific conditions, these notes can be converted into shares of the company’s common stock. This gives investors the potential to participate in the company’s growth if its stock price rises. So, why is this a strategic choice for Mara Bitcoin Mining ? Several reasons stand out: Cost-Effective Capital: With a 0% interest rate, MARA avoids the ongoing interest payments associated with traditional debt, preserving cash flow for operations and investments. Deferred Dilution: Unlike issuing new shares directly, convertible notes allow a company to raise capital without immediately diluting the ownership stake of existing shareholders. Dilution only occurs if and when the notes are converted into equity, typically at a higher stock price. Flexibility and Market Confidence: Issuing such a large volume of notes indicates strong investor confidence in MARA’s future and the Bitcoin market. It also provides MARA with significant financial flexibility to execute its growth strategy. How Will Mara Bitcoin Mining Deploy This Massive Capital? The $950 million raised isn’t just sitting idle; it’s earmarked for specific, high-impact purposes that align with Mara Bitcoin Mining ‘s core business and long-term vision. According to the press release, the funds will be allocated as follows: Additional Bitcoin Purchases: A significant portion of the funds will be dedicated to acquiring more Bitcoin. For a crypto mining company, Bitcoin isn’t just a product; it’s a strategic asset. Accumulating more Bitcoin allows MARA to benefit directly from any appreciation in Bitcoin’s value, strengthening its balance sheet and providing a hedge against market fluctuations. This move underscores MARA’s conviction in Bitcoin’s enduring value proposition. Repayment of $50 Million in Existing Debt: While $50 million might seem like a smaller slice of the pie, debt repayment is a crucial step for financial health. By reducing its existing liabilities, MARA improves its balance sheet, lowers its financial risk, and potentially enhances its creditworthiness for future endeavors. This demonstrates responsible financial management alongside aggressive growth. General Corporate Purposes: This broad category provides MARA with operational flexibility. It could encompass a range of uses, including: Investing in new, more efficient mining hardware and infrastructure. Expanding existing mining facilities or establishing new ones. Funding research and development into new mining technologies or energy solutions. Covering general operating expenses and ensuring smooth day-to-day business functions. This multi-pronged approach showcases a balanced strategy of growth (Bitcoin purchases, general corporate purposes) and financial prudence (debt repayment). The Broader Implications for Mara Bitcoin Mining and the Crypto Market MARA Holdings’ substantial convertible notes offering isn’t just a win for the company; it sends ripples across the entire crypto mining sector and the broader digital asset market. What does this mean? A Vote of Confidence: A $950 million raise, especially at 0% interest, is a strong signal that institutional investors have significant confidence in MARA’s business model and the long-term viability of Bitcoin mining. This can attract more investment into the sector. Competitive Edge: With enhanced ca",bitcoinworld,https://bitcoinworld.co.in/mara-bitcoin-mining-funding/,BTC|MINING|BUSINESS|MARKET|TRADING,Crypto News|Bitcoin Mining|Convertible notes|Crypto Investment|Digital Assets|MARA Holdings,BTC,"Mara Bitcoin Mining: Unlocking a Massive $950M for Future Growth. BitcoinWorld Mara Bitcoin Mining: Unlocking a Massive $950M for Future Growth The cryptocurrency world is buzzing with significant financial moves, and U.S.-based crypto mining giant MARA Holdings has just made headlines with a strategic funding initiative that could reshape its future. In a move signaling robust confidence in its growth trajectory and the long-term potential of digital assets, Mara Bitcoin Mining has successfully completed a substantial $950 million offering of 0% convertible senior notes due 2032. This monumental raise, as reported via a GlobeNewswire press release, is poised to fuel the company’s ambitious plans, primarily focusing on expanding its Bitcoin reserves, settling existing debts, and bolstering general corporate operations. But what exactly do these “convertible notes” mean, and how will this capital infusion impact the broader crypto landscape? What are Convertible Notes and Why are they Strategic for Mara Bitcoin Mining ? To fully grasp the significance of MARA Holdings’ latest financial maneuver, it’s essential to understand the instrument at its core: convertible senior notes. These aren’t your everyday loans. Think of them as a hybrid financial product, blending elements of both debt and equity. Here’s a quick breakdown: Debt Component: Initially, these notes function like bonds. Investors lend money to the company (MARA Holdings) and typically receive interest payments. In this specific case, the notes are 0% interest, making them particularly attractive for MARA as they avoid immediate cash outflows for interest. Equity Component: The “convertible” aspect is key. At a pre-determined future date, or under specific conditions, these notes can be converted into shares of the company’s common stock. This gives investors the potential to participate in the company’s growth if its stock price rises. So, why is this a strategic choice for Mara Bitcoin Mining ? Several reasons stand out: Cost-Effective Capital: With a 0% interest rate, MARA avoids the ongoing interest payments associated with traditional debt, preserving cash flow for operations and investments. Deferred Dilution: Unlike issuing new shares directly, convertible notes allow a company to raise capital without immediately diluting the ownership stake of existing shareholders. Dilution only occurs if and when the notes are converted into equity, typically at a higher stock price. Flexibility and Market Confidence: Issuing such a large volume of notes indicates strong investor confidence in MARA’s future and the Bitcoin market. It also provides MARA with significant financial flexibility to execute its growth strategy. How Will Mara Bitcoin Mining Deploy This Massive Capital? The $950 million raised isn’t just sitting idle; it’s earmarked for specific, high-impact purposes that align with Mara Bitcoin Mining ‘s core business and long-term vision. According to the press release, the funds will be allocated as follows: Additional Bitcoin Purchases: A significant portion of the funds will be dedicated to acquiring more Bitcoin. For a crypto mining company, Bitcoin isn’t just a product; it’s a strategic asset. Accumulating more Bitcoin allows MARA to benefit directly from any appreciation in Bitcoin’s value, strengthening its balance sheet and providing a hedge against market fluctuations. This move underscores MARA’s conviction in Bitcoin’s enduring value proposition. Repayment of $50 Million in Existing Debt: While $50 million might seem like a smaller slice of the pie, debt repayment is a crucial step for financial health. By reducing its existing liabilities, MARA improves its balance sheet, lowers its financial risk, and potentially enhances its creditworthiness for future endeavors. This demonstrates responsible financial management alongside aggressive growth. General Corporate Purposes: This broad category provides MARA with operational flexibility. It could encompass a range of uses, including: Investing in new, more efficient mining hardware and infrastructure. Expanding existing mining facilities or establishing new ones. Funding research and development into new mining technologies or energy solutions. Covering general operating expenses and ensuring smooth day-to-day business functions. This multi-pronged approach showcases a balanced strategy of growth (Bitcoin purchases, general corporate purposes) and financial prudence (debt repayment). The Broader Implications for Mara Bitcoin Mining and the Crypto Market MARA Holdings’ substantial convertible notes offering isn’t just a win for the company; it sends ripples across the entire crypto mining sector and the broader digital asset market. What does this mean? A Vote of Confidence: A $950 million raise, especially at 0% interest, is a strong signal that institutional investors have significant confidence in MARA’s business model and the long-term viability of Bitcoin mining. This can attract more investment into the sector. Competitive Edge: With enhanced ca"
2025-07-28 12:58:01+00:00,"Metavesco, Inc. Expands Digital Asset Portfolio with Strategic Purchase of 28 ETH Amid Growing Institutional Adoption","🚀 Are You Chasing New Coins? Catch the newest crypto opportunities. Be the first to buy, be the first to win! Click here to discover new altcoins! Metavesco, Inc. strategically",coinotag,https://en.coinotag.com/breakingnews/metavesco-inc-expands-digital-asset-portfolio-with-strategic-purchase-of-28-eth-amid-growing-institutional-adoption/,ETH|BTC|ALTCOIN,BTC|Core|ETH,BTC,"Metavesco, Inc. Expands Digital Asset Portfolio with Strategic Purchase of 28 ETH Amid Growing Institutional Adoption. 🚀 Are You Chasing New Coins? Catch the newest crypto opportunities. Be the first to buy, be the first to win! Click here to discover new altcoins! Metavesco, Inc. strategically"
2025-07-28 13:00:00+00:00,"Avalanche gains $250M RWA boost with Grove, Janus Henderson funds","Grove will deploy two Janus Henderson products on the Avalanche blockchain, targeting US Treasurys and collateralized loan obligations.",Cointelegraph,https://cointelegraph.com/news/grove-janus-henderson-funds-avalanche-rwa?utm_source=rss_feed&utm_medium=rss&utm_campaign=rss_partner_inbound,,,BTC,"Avalanche gains $250M RWA boost with Grove, Janus Henderson funds. Grove will deploy two Janus Henderson products on the Avalanche blockchain, targeting US Treasurys and collateralized loan obligations."
2025-07-28 13:00:00+00:00,Bitcoin Rally Builds Amid US-China Tariff Pause,"For now, analysts are divided on whether Bitcoin can sustain this rebound, with some pointing to $119.5K as a crucial breakout level and others expecting a retest of lower support near $114.5K. Meanwhile, Japanese firm Metaplanet doubled down on its Bitcoin strategy by purchasing an additional 780 BTC for $92 million, bringing its total to 17,132 BTC. The company’s aggressive BTC accumulation fueled a 246% year-to-date surge in its stock price, making it Japan’s top-performing stock with plans to expand into digital banking. Bitcoin Gains Ground Bitcoin surged past $119,000 on Sunday, staging an impressive rebound from two-week lows close to $114,500. The move reignited bullish momentum and started fresh discussions among traders about whether BTC could soon break above key resistance levels. BTC price action over the past 7 days (Source: CoinMarketCap ) Charts show BTC/USD approaching a critical reclaim area, with bulls trying to close the day above the 10-day simple moving average. This recovery came despite recent bearish pressure after one of the largest-ever Bitcoin sales, and coincided with news that the US and China agreed to postpone the implementation of new trade tariffs, which may have eased broader market tension. Crypto investor Ted Pillows commented that Bitcoin needs to decisively clear $119.5K for a breakout, and added that if it fails to do so, current consolidation could persist. He is optimistic that BTC might achieve this breakout next month, initiating the next leg higher. Popular analyst Rekt Capital pointed out that Bitcoin successfully closed above the lower boundary of its recent range, suggesting that the asset could be reentering a previously lost trading zone. He warned, however, that any pullbacks into that range low could serve as critical retests to confirm the move. Not all analysts are convinced the uptrend will hold without further tests to the downside. Trader CrypNuevo identified a potential mid-term target in the $114.5K–$113.6K range, which aligns with a concentration of order-book liquidity and prior liquidation zones. From this perspective, a revisit to lower support levels is still very much on the table. According to CoinGlass data , the current “max pain” point for short positions lies around $119,650. If BTC were to push back toward its all-time highs near $123,000, the resulting short liquidations could surpass $1.1 billion. Coinank''s own liquidity models also indicate strong resistance between $119,000 and $120,000 due to dense liquidation clusters at those levels. Adding to the volatility picture, analyst TheKingfisher warned that short-term price swings may become more pronounced. His gamma exposure analysis showed dealers heavily short gamma, a condition that tends to increase market turbulence as they hedge their positions. This dynamic suggests that traders should brace for amplified volatility in the immediate future. Metaplanet Buys More BTC Some companies are not too worried about whether BTC’s price will go up or down next. In fact, Japanese investment firm Metaplanet acquired an additional 780 Bitcoin, bringing its total holdings to 17,132 BTC. The company revealed the purchase on Monday, and shared that it paid an average of approximately $118,145 per Bitcoin—just under the current trading price of $118,656. The total cost of the latest buy was about $92 million, and in total, Metaplanet invested roughly $1.7 billion in Bitcoin, with an average acquisition cost of $99,640 per coin. This strategic move places Metaplanet seventh on the list of top Bitcoin corporate treasuries worldwide. It sits just behind Trump Media & Technology Group, which holds 18,430 BTC, and ahead of Galaxy Digital Holdings, led by Michael Novogratz, which owns 12,830 BTC. While Metaplanet’s holdings are impressive, they still fall far short of Strategy, the global leader with over 607,770 BTC, valued at more than $72 billion. Top Bitcoin treasury companies (Source: BitcoinTreasuries.NET ) Metaplanet made it clear that its Bitcoin purchases are part of a broader vision. Reports suggest the company plans to eventually leverage its digital assets to acquire cash-generating businesses, potentially including a digital bank in Japan. This approach reflects a tailored strategy, which CEO Simon Gerovich described in a recent Forbes Japan interview as “Japan-native,” designed to align with local regulatory and tax frameworks. He also explained that the company’s model enables Bitcoin exposure through tax-free savings accounts, making it more accessible to Japanese investors. Metaplanet’s YTD stock price (Source: Google Finance ) The bold Bitcoin-focused strategy has paid off handsomely for Metaplanet’s shareholders. The company’s stock has soared 517% over the past year and 246% year-to-date, trading at $8.36 as of Monday. Gerovich acknowledged the unexpected pace of growth, and said that Metaplanet became Japan’s top-performing stock with record trading volume and a market cap of more ",coinpaper,https://coinpaper.com/10215/bitcoin-rally-builds-amid-us-china-tariff-pause,BTC|TRADING|BUSINESS|ASIA|MARKET,News|Crypto,BTC,"Bitcoin Rally Builds Amid US-China Tariff Pause. For now, analysts are divided on whether Bitcoin can sustain this rebound, with some pointing to $119.5K as a crucial breakout level and others expecting a retest of lower support near $114.5K. Meanwhile, Japanese firm Metaplanet doubled down on its Bitcoin strategy by purchasing an additional 780 BTC for $92 million, bringing its total to 17,132 BTC. The company’s aggressive BTC accumulation fueled a 246% year-to-date surge in its stock price, making it Japan’s top-performing stock with plans to expand into digital banking. Bitcoin Gains Ground Bitcoin surged past $119,000 on Sunday, staging an impressive rebound from two-week lows close to $114,500. The move reignited bullish momentum and started fresh discussions among traders about whether BTC could soon break above key resistance levels. BTC price action over the past 7 days (Source: CoinMarketCap ) Charts show BTC/USD approaching a critical reclaim area, with bulls trying to close the day above the 10-day simple moving average. This recovery came despite recent bearish pressure after one of the largest-ever Bitcoin sales, and coincided with news that the US and China agreed to postpone the implementation of new trade tariffs, which may have eased broader market tension. Crypto investor Ted Pillows commented that Bitcoin needs to decisively clear $119.5K for a breakout, and added that if it fails to do so, current consolidation could persist. He is optimistic that BTC might achieve this breakout next month, initiating the next leg higher. Popular analyst Rekt Capital pointed out that Bitcoin successfully closed above the lower boundary of its recent range, suggesting that the asset could be reentering a previously lost trading zone. He warned, however, that any pullbacks into that range low could serve as critical retests to confirm the move. Not all analysts are convinced the uptrend will hold without further tests to the downside. Trader CrypNuevo identified a potential mid-term target in the $114.5K–$113.6K range, which aligns with a concentration of order-book liquidity and prior liquidation zones. From this perspective, a revisit to lower support levels is still very much on the table. According to CoinGlass data , the current “max pain” point for short positions lies around $119,650. If BTC were to push back toward its all-time highs near $123,000, the resulting short liquidations could surpass $1.1 billion. Coinank''s own liquidity models also indicate strong resistance between $119,000 and $120,000 due to dense liquidation clusters at those levels. Adding to the volatility picture, analyst TheKingfisher warned that short-term price swings may become more pronounced. His gamma exposure analysis showed dealers heavily short gamma, a condition that tends to increase market turbulence as they hedge their positions. This dynamic suggests that traders should brace for amplified volatility in the immediate future. Metaplanet Buys More BTC Some companies are not too worried about whether BTC’s price will go up or down next. In fact, Japanese investment firm Metaplanet acquired an additional 780 Bitcoin, bringing its total holdings to 17,132 BTC. The company revealed the purchase on Monday, and shared that it paid an average of approximately $118,145 per Bitcoin—just under the current trading price of $118,656. The total cost of the latest buy was about $92 million, and in total, Metaplanet invested roughly $1.7 billion in Bitcoin, with an average acquisition cost of $99,640 per coin. This strategic move places Metaplanet seventh on the list of top Bitcoin corporate treasuries worldwide. It sits just behind Trump Media & Technology Group, which holds 18,430 BTC, and ahead of Galaxy Digital Holdings, led by Michael Novogratz, which owns 12,830 BTC. While Metaplanet’s holdings are impressive, they still fall far short of Strategy, the global leader with over 607,770 BTC, valued at more than $72 billion. Top Bitcoin treasury companies (Source: BitcoinTreasuries.NET ) Metaplanet made it clear that its Bitcoin purchases are part of a broader vision. Reports suggest the company plans to eventually leverage its digital assets to acquire cash-generating businesses, potentially including a digital bank in Japan. This approach reflects a tailored strategy, which CEO Simon Gerovich described in a recent Forbes Japan interview as “Japan-native,” designed to align with local regulatory and tax frameworks. He also explained that the company’s model enables Bitcoin exposure through tax-free savings accounts, making it more accessible to Japanese investors. Metaplanet’s YTD stock price (Source: Google Finance ) The bold Bitcoin-focused strategy has paid off handsomely for Metaplanet’s shareholders. The company’s stock has soared 517% over the past year and 246% year-to-date, trading at $8.36 as of Monday. Gerovich acknowledged the unexpected pace of growth, and said that Metaplanet became Japan’s top-performing stock with record trading volume and a market cap of more"
