DATETIME,HEADLINE,SUMMARY,SOURCE,URL,CATEGORIES,TAGS,asset,text
2025-07-24 04:19:06+00:00,"Ether, XRP Trades Book Bigger Losses Than Bitcoin as Bulls See $680M Liquidations","A sharp pullback across crypto markets on Tuesday triggered nearly $735 million in liquidations with bulls bearing the brunt. Ether (ETH) and XRP tracked futures bets booked larger losses than bitcoin in an unusual move, indicative of the higher interest toward altcoin traders in the past week. CoinGlass data shows ETH traders lost $152.78 million, the largest for any asset, followed by $88.58 million in liquidations for XRP. Bitcoin came in third at $65.29 million, despite its larger market cap and deeper liquidity. While price action across the majors was mostly down by only a few percentage points, the high leverage used by retail traders in altcoins likely amplified their losses. In total, $625.5 million of the liquidations were on long positions, suggesting the selloff caught many bulls off guard after weeks of upward momentum. Other heavily hit tokens included Solana’s SOL at $41 million, dogecoin (DOGE) at $40 million, and smaller DeFi tokens like SPK and PUMP seeing over $10 million in positions wiped. The absence of a clear catalyst and profit-taking near key resistance levels may have exacerbated the selloff. Ether had recently flirted with the $4,000 mark while Bitcoin traded above $118,000 — levels that had already prompted profit booking from larger wallets. As of writing, ETH is down roughly 3.6% on the day to trade near $3,540, while XRP fell 6% to $3.25, extending its weekly loss to over 12%. Bitcoin fared better, slipping just under 2% to hover around $116,800. Crypto liquidations occur when leveraged positions are forcibly closed due to a price move beyond a trader’s margin threshold. This typically results in major losses and can trigger cascade effects during volatile moves. Traders use liquidation data to gauge market sentiment and positioning. Large long liquidations often signal panic bottoms, while short liquidations may precede a squeeze. Spikes in liquidations also help identify overcrowded trades and potential reversals. When paired with open interest and funding rate data, liquidation metrics can offer strategic entry or exit points, especially in overleveraged markets prone to sudden flushes or rallies.",coindesk,https://www.coindesk.com/markets/2025/07/24/ether-xrp-trades-book-bigger-losses-than-bitcoin-as-bulls-see-usd680m-liquidations,BTC|MARKET|XRP|TRADING|ETH,Markets|Trading|Markets|News,BTC,"Ether, XRP Trades Book Bigger Losses Than Bitcoin as Bulls See $680M Liquidations. A sharp pullback across crypto markets on Tuesday triggered nearly $735 million in liquidations with bulls bearing the brunt. Ether (ETH) and XRP tracked futures bets booked larger losses than bitcoin in an unusual move, indicative of the higher interest toward altcoin traders in the past week. CoinGlass data shows ETH traders lost $152.78 million, the largest for any asset, followed by $88.58 million in liquidations for XRP. Bitcoin came in third at $65.29 million, despite its larger market cap and deeper liquidity. While price action across the majors was mostly down by only a few percentage points, the high leverage used by retail traders in altcoins likely amplified their losses. In total, $625.5 million of the liquidations were on long positions, suggesting the selloff caught many bulls off guard after weeks of upward momentum. Other heavily hit tokens included Solana’s SOL at $41 million, dogecoin (DOGE) at $40 million, and smaller DeFi tokens like SPK and PUMP seeing over $10 million in positions wiped. The absence of a clear catalyst and profit-taking near key resistance levels may have exacerbated the selloff. Ether had recently flirted with the $4,000 mark while Bitcoin traded above $118,000 — levels that had already prompted profit booking from larger wallets. As of writing, ETH is down roughly 3.6% on the day to trade near $3,540, while XRP fell 6% to $3.25, extending its weekly loss to over 12%. Bitcoin fared better, slipping just under 2% to hover around $116,800. Crypto liquidations occur when leveraged positions are forcibly closed due to a price move beyond a trader’s margin threshold. This typically results in major losses and can trigger cascade effects during volatile moves. Traders use liquidation data to gauge market sentiment and positioning. Large long liquidations often signal panic bottoms, while short liquidations may precede a squeeze. Spikes in liquidations also help identify overcrowded trades and potential reversals. When paired with open interest and funding rate data, liquidation metrics can offer strategic entry or exit points, especially in overleveraged markets prone to sudden flushes or rallies."
2025-07-24 04:22:23+00:00,"[LIVE] Crypto News Today: Latest Updates for July 24, 2025 – Ethereum Flips Bitcoin in Spot Volume as Whales Load Up on ETH Amid Altcoin Rotation","For the first time in over a year, Ethereum has overtaken Bitcoin in spot trading volume, signaling a potential shift in investor sentiment. According to CryptoQuant, ETH recorded $25.7 billion in spot volume last week, surpassing Bitcoin’s $24.4 billion. The ETH/BTC volume ratio broke above 1 for the first time since June 2024, as traders increasingly rotate funds into Ethereum and various altcoins. Seven newly created wallets have recently accumulated 466,253 ETH ($1.7B), including 40,591 ETH ($148M) added just today, as per Lookonchain data. But what else is happening in crypto news today? Follow our up-to-date live coverage below. The post [LIVE] Crypto News Today: Latest Updates for July 24, 2025 – Ethereum Flips Bitcoin in Spot Volume as Whales Load Up on ETH Amid Altcoin Rotation appeared first on Cryptonews .",cryptonews,https://cryptonews.com/news/live-crypto-news-today-latest-updates-for-july-24-2025/,ETH|BTC|ALTCOIN|BUSINESS|TRADING,Industry Talk|Altcoins|Bitcoin|Ethereum,BTC,"[LIVE] Crypto News Today: Latest Updates for July 24, 2025 – Ethereum Flips Bitcoin in Spot Volume as Whales Load Up on ETH Amid Altcoin Rotation. For the first time in over a year, Ethereum has overtaken Bitcoin in spot trading volume, signaling a potential shift in investor sentiment. According to CryptoQuant, ETH recorded $25.7 billion in spot volume last week, surpassing Bitcoin’s $24.4 billion. The ETH/BTC volume ratio broke above 1 for the first time since June 2024, as traders increasingly rotate funds into Ethereum and various altcoins. Seven newly created wallets have recently accumulated 466,253 ETH ($1.7B), including 40,591 ETH ($148M) added just today, as per Lookonchain data. But what else is happening in crypto news today? Follow our up-to-date live coverage below. The post [LIVE] Crypto News Today: Latest Updates for July 24, 2025 – Ethereum Flips Bitcoin in Spot Volume as Whales Load Up on ETH Amid Altcoin Rotation appeared first on Cryptonews ."
2025-07-24 04:24:25+00:00,Ethereum Spot ETF Sees Strong Inflows as Bitcoin ETF Faces Outflows,"The post Ethereum Spot ETF Sees Strong Inflows as Bitcoin ETF Faces Outflows appeared first on Coinpedia Fintech News On July 23, Ethereum spot ETFs recorded a net inflow of $332 million, sustaining a 14-day streak of consecutive inflows. Notably, BlackRock’s ETHA led with a single-day net inflow of $325 million. In contrast, U.S. Bitcoin spot ETFs experienced a net outflow of about $86 million and have now seen outflows for three straight days. These trends suggest robust institutional interest in Ethereum, while Bitcoin ETFs endure renewed selling pressure",coinpedia,https://coinpedia.org/crypto-live-news/ethereum-spot-etf-sees-strong-inflows-as-bitcoin-etf-faces-outflows/,BTC|ETH,Short News|Crypto news,BTC,"Ethereum Spot ETF Sees Strong Inflows as Bitcoin ETF Faces Outflows. The post Ethereum Spot ETF Sees Strong Inflows as Bitcoin ETF Faces Outflows appeared first on Coinpedia Fintech News On July 23, Ethereum spot ETFs recorded a net inflow of $332 million, sustaining a 14-day streak of consecutive inflows. Notably, BlackRock’s ETHA led with a single-day net inflow of $325 million. In contrast, U.S. Bitcoin spot ETFs experienced a net outflow of about $86 million and have now seen outflows for three straight days. These trends suggest robust institutional interest in Ethereum, while Bitcoin ETFs endure renewed selling pressure"
2025-07-24 04:26:19+00:00,Ethereum Spot ETF Sees $332.2 Million Inflow as Bitcoin Spot ETF Faces Third Day of Outflows,"🚀 Are You Chasing New Coins? Catch the newest crypto opportunities. Be the first to buy, be the first to win! Click here to discover new altcoins! On July 24,",coinotag,https://en.coinotag.com/breakingnews/ethereum-spot-etf-sees-332-2-million-inflow-as-bitcoin-spot-etf-faces-third-day-of-outflows/,BTC|ETH|ALTCOIN,BTC|ETH,BTC,"Ethereum Spot ETF Sees $332.2 Million Inflow as Bitcoin Spot ETF Faces Third Day of Outflows. 🚀 Are You Chasing New Coins? Catch the newest crypto opportunities. Be the first to buy, be the first to win! Click here to discover new altcoins! On July 24,"
2025-07-24 04:32:41+00:00,"Spot Ethereum ETFs See Sustained Inflows, Indicating Growing Institutional Interest in Ethereum","🚀 Are You Chasing New Coins? Catch the newest crypto opportunities. Be the first to buy, be the first to win! Click here to discover new altcoins! Spot Ethereum ETFs",coinotag,https://en.coinotag.com/spot-ethereum-etfs-see-sustained-inflows-indicating-growing-institutional-interest-in-ethereum/,ETH|BTC|ALTCOIN,Ethereum|News|BTC|ETH,BTC,"Spot Ethereum ETFs See Sustained Inflows, Indicating Growing Institutional Interest in Ethereum. 🚀 Are You Chasing New Coins? Catch the newest crypto opportunities. Be the first to buy, be the first to win! Click here to discover new altcoins! Spot Ethereum ETFs"
2025-07-24 04:35:08+00:00,Long-Term Bitcoin Holders Sell as Market Rally Continues,"The post Long-Term Bitcoin Holders Sell as Market Rally Continues appeared first on Coinpedia Fintech News The Bitcoin market is experiencing a notable surge in long-term holder activity, with the Monthly Cumulative Distribution Days (CDD) to Yearly CDD ratio hitting 0.25—levels reminiscent of past peaks in 2014 and 2019. This ratio signals that experienced holders are actively moving dormant coins onto the market. Even though more long-term holders are selling their Bitcoin, strong demand from treasuries and steady investment into Bitcoin ETFs are likely to keep the price rally going. This selling may slow down the pace of gains, but it probably won’t stop the rally.",coinpedia,https://coinpedia.org/crypto-live-news/long-term-bitcoin-holders-sell-as-market-rally-continues/,BTC|TRADING|MARKET,Short News|Bitcoin,BTC,"Long-Term Bitcoin Holders Sell as Market Rally Continues. The post Long-Term Bitcoin Holders Sell as Market Rally Continues appeared first on Coinpedia Fintech News The Bitcoin market is experiencing a notable surge in long-term holder activity, with the Monthly Cumulative Distribution Days (CDD) to Yearly CDD ratio hitting 0.25—levels reminiscent of past peaks in 2014 and 2019. This ratio signals that experienced holders are actively moving dormant coins onto the market. Even though more long-term holders are selling their Bitcoin, strong demand from treasuries and steady investment into Bitcoin ETFs are likely to keep the price rally going. This selling may slow down the pace of gains, but it probably won’t stop the rally."
2025-07-24 04:38:37+00:00,XRP Price Trims Gains After Rally – Is This Just a Healthy Correction?,"XRP price started a downside correction from the $3.650 zone. The price is now trading below $3.30 and remains at risk of more losses. XRP price started a downside correction below the $3.50 zone. The price is now trading below $3.450 and the 100-hourly Simple Moving Average. There is a key bearish trend line forming with resistance at $3.30 on the hourly chart of the XRP/USD pair (data source from Kraken). The pair could start another increase if it stays above the $3.050 zone. XRP Price Dips Further XRP price started a fresh decline after it failed to clear the $3.650 resistance zone, like Bitcoin and Ethereum . The price declined below the $3.450 and $3.350 support levels. The decline was such that the price traded below the $3.120 level. A low was formed at $3.050 and the price is now consolidating losses near the 23.6% Fib retracement level of the recent decline from the $3.650 swing high to the $3.050 low. The price is now trading below $3.450 and the 100-hourly Simple Moving Average. There is also a key bearish trend line forming with resistance at $3.30 on the hourly chart of the XRP/USD pair. On the upside, the price might face resistance near the $3.2320 level. The first major resistance is near the $3.2650 level. A clear move above the $3.2650 resistance might send the price toward the $3.350 resistance or the 50% Fib retracement level of the recent decline from the $3.650 swing high to the $3.050 low. Any more gains might send the price toward the $3.450 resistance or even $3.50 in the near term. The next major hurdle for the bulls might be near the $3.650 zone. Another Drop? If XRP fails to clear the $3.350 resistance zone, it could start another decline. Initial support on the downside is near the $3.150 level. The next major support is near the $3.120 level. If there is a downside break and a close below the $3.120 level, the price might continue to decline toward the $3.050 support. The next major support sits near the $3.00 zone. Technical Indicators Hourly MACD – The MACD for XRP/USD is now losing pace in the bearish zone. Hourly RSI (Relative Strength Index) – The RSI for XRP/USD is now below the 50 level. Major Support Levels – $3.120 and $3.050. Major Resistance Levels – $3.250 and $3.350.",newsbtc,https://www.newsbtc.com/analysis/xrp/xrp-price-trims-gains-3-350/,TRADING|XRP|BTC|ETH|EXCHANGE,XRP|Ripple|XRPBTC|XRPUSD|xrpusdt,BTC,"XRP Price Trims Gains After Rally – Is This Just a Healthy Correction?. XRP price started a downside correction from the $3.650 zone. The price is now trading below $3.30 and remains at risk of more losses. XRP price started a downside correction below the $3.50 zone. The price is now trading below $3.450 and the 100-hourly Simple Moving Average. There is a key bearish trend line forming with resistance at $3.30 on the hourly chart of the XRP/USD pair (data source from Kraken). The pair could start another increase if it stays above the $3.050 zone. XRP Price Dips Further XRP price started a fresh decline after it failed to clear the $3.650 resistance zone, like Bitcoin and Ethereum . The price declined below the $3.450 and $3.350 support levels. The decline was such that the price traded below the $3.120 level. A low was formed at $3.050 and the price is now consolidating losses near the 23.6% Fib retracement level of the recent decline from the $3.650 swing high to the $3.050 low. The price is now trading below $3.450 and the 100-hourly Simple Moving Average. There is also a key bearish trend line forming with resistance at $3.30 on the hourly chart of the XRP/USD pair. On the upside, the price might face resistance near the $3.2320 level. The first major resistance is near the $3.2650 level. A clear move above the $3.2650 resistance might send the price toward the $3.350 resistance or the 50% Fib retracement level of the recent decline from the $3.650 swing high to the $3.050 low. Any more gains might send the price toward the $3.450 resistance or even $3.50 in the near term. The next major hurdle for the bulls might be near the $3.650 zone. Another Drop? If XRP fails to clear the $3.350 resistance zone, it could start another decline. Initial support on the downside is near the $3.150 level. The next major support is near the $3.120 level. If there is a downside break and a close below the $3.120 level, the price might continue to decline toward the $3.050 support. The next major support sits near the $3.00 zone. Technical Indicators Hourly MACD – The MACD for XRP/USD is now losing pace in the bearish zone. Hourly RSI (Relative Strength Index) – The RSI for XRP/USD is now below the 50 level. Major Support Levels – $3.120 and $3.050. Major Resistance Levels – $3.250 and $3.350."
2025-07-24 04:41:41+00:00,Bitcoin Coin Days Destroyed Surge Signals Long-Term Holder Activity Amid Institutional Demand,"🚀 Are You Chasing New Coins? Catch the newest crypto opportunities. Be the first to buy, be the first to win! Click here to discover new altcoins! Bitcoin’s price range",coinotag,https://en.coinotag.com/breakingnews/bitcoin-coin-days-destroyed-surge-signals-long-term-holder-activity-amid-institutional-demand/,BTC|ALTCOIN|TRADING,BTC,BTC,"Bitcoin Coin Days Destroyed Surge Signals Long-Term Holder Activity Amid Institutional Demand. 🚀 Are You Chasing New Coins? Catch the newest crypto opportunities. Be the first to buy, be the first to win! Click here to discover new altcoins! Bitcoin’s price range"
2025-07-24 04:52:02+00:00,"Bitcoin Dips Below $118,000 on July 24 Amid 0.71% 24-Hour Decline","🚀 Are You Chasing New Coins? Catch the newest crypto opportunities. Be the first to buy, be the first to win! Click here to discover new altcoins! On July 24,",coinotag,https://en.coinotag.com/breakingnews/bitcoin-dips-below-118000-on-july-24-amid-0-71-24-hour-decline/,BTC|ALTCOIN,BTC,BTC,"Bitcoin Dips Below $118,000 on July 24 Amid 0.71% 24-Hour Decline. 🚀 Are You Chasing New Coins? Catch the newest crypto opportunities. Be the first to buy, be the first to win! Click here to discover new altcoins! On July 24,"
